Sheet: Sheet1
A1: Ref. Des. | B1: Q'ty | C1: Total | D1: Model | E1: Description | F1: HP P/N | G1: Mfr. P/N | H1: Mfr. Code
A4: Capacitors | J4: Capacitance | K4: Tolerance | L4: Voltage Rating | M4: Material
A5: C20,23 | B5: 2 | C5: of:=2*[.B5] -> 4 | D5: 14,15 | E5: CAP-FXD 1UF +-20% 50V AL-ELECTLT | F5: 0180-3970 | H5: 28480 | J5: 1µ | K5: +-20% | L5: 50V | M5: AL-ELECTLT
A6: C9,41,42,43,55 | B6: 5 | C6: of:=4*[.B6] -> 20 | D6: ALL | E6: CAP-FXD 1UF +-20% 50V AL-ELECTLT | F6: 0180-3970 | H6: 28480 | J6: 1µ | K6: +-20% | L6: 50V | M6: AL-ELECTLT
A7: C57 | B7: 1 | C7: of:=4*[.B7] -> 4 | D7: ALL | E7: CAP-FXD 47UF +-20% 50V AL-ELECTLT | F7: 0180-4437 | H7: 28480 | J7: 47µ | K7: +-20% | L7: 50V | M7: AL-ELECTLT
A8: C2 | B8: 1 | C8: of:=1*[.B8] -> 1 | D8: 17 | E8: CAP-FXD 220UF 100V +-20% AL-ELECTLT | F8: 0180-3595 | H8: 28480 | J8: 220µ | K8: +-20% | L8: 100V | M8: AL-ELECTLT
A9: C2 | B9: 1 | C9: of:=1*[.B9] -> 1 | D9: 16 | E9: CAP-FXD 330UF 63V +-20% AL-ELECTLT | F9: 0180-4452 | H9: 28480 | J9: 330µ | K9: +-20% | L9: 63V | M9: AL-ELECTLT
A10: C2 | B10: 1 | C10: of:=1*[.B10] -> 1 | D10: 15 | E10: CAP-FXD 470UF 50V +-20% AL-ELECTLT | F10: 0180-4355 | H10: 28480 | J10: 470µ | K10: +-20% | L10: 50V | M10: AL-ELECTLT
A11: C2 | B11: 1 | C11: of:=1*[.B11] -> 1 | D11: 14 | E11: CAP-FXD 1000UF 25V +-20% AL-ELECTLT | F11: 0180-4360 | H11: 28480 | J11: 1000µ | K11: +-20% | L11: 25V | M11: AL-ELECTLT
A12: C52 | B12: 1 | C12: of:=4*[.B12] -> 4 | D12: ALL | E12: CAP-FXD 330UF +-20% 35V AL-ELECTLT | F12: 0180-4085 | H12: 28480 | J12: 330µ | K12: +-20% | L12: 35V | M12: AL-ELECTLT
A13: C53 | B13: 1 | C13: of:=4*[.B13] -> 4 | D13: ALL | E13: CAP-FXD 470UF 50V +-20% AL-ELECTLT | F13: 0180-4355 | H13: 28480 | J13: 470µ | K13: +-20% | L13: 50V | M13: AL-ELECTLT
A14: C6 | B14: 1 | C14: of:=4*[.B14] -> 4 | D14: ALL | E14: CAP-FXD 4700UF +-20% 25V AL-ELECTLT | F14: 0180-3990 | H14: 28480 | J14: 4700µ | K14: +-20% | L14: 25V | M14: AL-ELECTLT
A16: C7,8 | B16: 2 | C16: of:=1*[.B16] -> 2 | D16: 17 | E16: CAP-FXD 2700UF 160V +-20% AL-ELECTLT | F16: 0180-4566 | H16: 28480 | J16: 2700µ | K16: +-20% | L16: 160V | M16: AL-ELECTLT
A17: C7,8 | B17: 2 | C17: of:=1*[.B17] -> 2 | D17: 16 | E17: CAP-FXD 5600UF 100V +-20% AL-ELECTLT | F17: 0180-4607 | H17: 28480 | J17: 5600µ | K17: +-20% | L17: 100V | M17: AL-ELECTLT
A18: C7,8 | B18: 2 | C18: of:=1*[.B18] -> 2 | D18: 15 | E18: CAP-FXD 12000UF 63V +-20% AL-ELECTLT | F18: 0180-4568 | H18: 28480 | J18: 12000µ | K18: +-20% | L18: 63V | M18: AL-ELECTLT
A19: C7,8 | B19: 2 | C19: of:=1*[.B19] -> 2 | D19: 14 | E19: CAP-FXD 39000UF 25V +-20% AL-ELECTLT | F19: 0180-4567 | H19: 28480 | J19: 39000µ | K19: +-20% | L19: 25V | M19: AL-ELECTLT
A21: C37 | B21: 1 | C21: of:=4*[.B21] -> 4 | D21: ALL | E21: CAP-FXD 100PF +-5% 100V CER COG | F21: 0160-4801 | H21: 28480 | J21: 100p | K21: +-5% | L21: 100V | M21: CER | N21: COG | P21: axial
A22: C62 | B22: 1 | C22: of:=2*[.B22] -> 2 | D22: 16,17 | E22: CAP-FXD 470PF +-5% 100V CER COG | F22: 0160-4808 | H22: 28480 | J22: 470p | K22: +-5% | L22: 100V | M22: CER | N22: COG | P22: axial
A23: C19,22 | B23: 2 | C23: of:=2*[.B23] -> 4 | D23: 14,15 | E23: CAP-FXD 1000PF +-5% 100V CER COG | F23: 0160-4822 | H23: 28480 | J23: 1000p | K23: +-5% | L23: 100V | M23: CER | N23: COG | P23: axial
A24: C33,35,44,45,46,56 | B24: 6 | C24: of:=4*[.B24] -> 24 | D24: ALL | E24: CAP-FXD 1000PF +-5% 100V CER COG | F24: 0160-4822 | H24: 28480 | J24: 1000p | K24: +-5% | L24: 100V | M24: CER | N24: COG | P24: axial
A26: C11,16,17,25,26 | B26: 5 | C26: of:=2*[.B26] -> 10 | D26: 14,15 | E26: CAP-FXD 0.01UF +-10% 100V CER X7R | F26: 0160-4832 | H26: 28480 | J26: 0.01µ | K26: +-10% | L26: 100V | M26: CER | N26: X7R | P26: axial
A27: C13,14,15,30,32,34,38,39,50,54 | B27: 10 | C27: of:=4*[.B27] -> 40 | D27: ALL | E27: CAP-FXD 0.01UF +-10% 100V CER X7R | F27: 0160-4832 | H27: 28480 | J27: 0.01µ | K27: +-10% | L27: 100V | M27: CER | N27: X7R | P27: axial
A28: C29 | B28: 1 | C28: of:=2*[.B28] -> 2 | D28: 14,15 | E28: CAP-FXD 0.01UF +-10% 100V CER X7R | F28: 0160-4832 | H28: 28480 | J28: 0.01µ | K28: +-10% | L28: 100V | M28: CER | N28: X7R | P28: axial
A29: C1,3,47 | B29: 3 | C29: of:=4*[.B29] -> 12 | D29: ALL | E29: CAP-FXD .1UF +-10% 50V CER X7R | F29: 0160-4835 | H29: 28480 | J29: 0.1µ | K29: +-10% | L29: 50V | M29: CER | N29: X7R | P29: axial
A30: C12 | B30: 1 | C30: of:=2*[.B30] -> 2 | D30: 14,15 | E30: CAP-FXD .1UF +-10% 50V CER X7R | F30: 0160-4835 | H30: 28480 | J30: 0.1µ | K30: +-10% | L30: 50V | M30: CER | N30: X7R | P30: axial
A32: C36 | B32: 1 | C32: of:=4*[.B32] -> 4 | D32: ALL | E32: CAP-FXD 2200PF +-10% 50V CER Y5P | F32: 0160-7548 | H32: 28480 | J32: 2200p | K32: +-10% | L32: 50V | M32: CER | N32: Y5P | P32: radial
A33: C4,5 | B33: 2 | C33: of:=4*[.B33] -> 8 | D33: ALL | E33: CAP-FXD 0.1UF +-20% 500V CER Z5U | F33: 0160-0269 | H33: 28480 | J33: 0.1µ | K33: +-20% | L33: 500V | M33: CER | N33: Z5U | P33: disc, orange
A34: C67 | B34: 1 | C34: of:=4*[.B34] -> 4 | D34: ALL | E34: CAP-FXD 0.22uF +-20% 50V CER | F34: 0160-0263 | J34: 0.22µ | K34: +-20% | L34: 50V | M34: CER | P34: radial
A36: C63,64,65,66 | B36: 4 | C36: of:=1*[.B36] -> 4 | D36: 17 | E36: CAP-FXD 0.012UF +-10% 200V PE-FL | F36: 0160-0301 | H36: 28480 | J36: 0.012µ | K36: +-10% | L36: 200V | M36: PE-FL
A37: C18,21,24,27 | B37: 4 | C37: of:=2*[.B37] -> 8 | D37: 14,15 | E37: CAP-FXD .1UF +-10% 630V POLYE-FL | F37: 0160-7077 | H37: 28480 | J37: 0.1µ | K37: +-10% | L37: 630V | M37: POLYE-FL | P37: box, long, green
A38: C10,48,49 | B38: 3 | C38: of:=4*[.B38] -> 12 | D38: ALL | E38: CAP-FXD 0.33UF +-10% 50V POLYE-FL | F38: 0160-7449 | H38: 28480 | J38: 0.33µ | K38: +-10% | L38: 50V | M38: POLYE-FL | P38: box, weird, white
A39: C28 | B39: 1 | C39: of:=4*[.B39] -> 4 | D39: ALL | E39: CAP-FXD 0.33UF +-10% 250V POLYE-MET | F39: 0160-6225 | H39: 28480 | J39: 0.33µ | K39: +-10% | L39: 250V | M39: POLYE-MET | P39: box, long, green
A41: C31 | B41: 1 | C41: of:=4*[.B41] -> 4 | D41: ALL | E41: CAP-FXD 4700PF +-2% 50V POLYP-FL | F41: 0160-7075 | H41: 28480 | J41: 4700p | K41: +-2% | L41: 50V | M41: POLYP-FL | P41: radial, high
A42: C29 | B42: 1 | C42: of:=2*[.B42] -> 2 | D42: 16,17 | E42: CAP-FXD .047UF +-10% 100V POLYP-MET | F42: 0160-7673 | H42: 28480 | J42: 0.047µ | K42: +-10% | L42: 100V | M42: POLYP-MET
A43: C40 | B43: 1 | C43: of:=4*[.B43] -> 4 | D43: ALL | E43: CAP-FXD .047UF +-10% 100V POLYP-MET | F43: 0160-7673 | H43: 28480 | J43: 0.047µ | K43: +-10% | L43: 100V | M43: POLYP-MET | P43: axial, fat
A44: C61 | B44: 1 | C44: of:=2*[.B44] -> 2 | D44: 16,17 | E44: CAP-FXD 1UF +-10% 250V POLYP-MET | F44: 0160-7363 | H44: 28480 | J44: 1µ | K44: +-10% | L44: 250V | M44: POLYP-MET
A46: C59,60 | B46: 2 | C46: of:=4*[.B46] -> 8 | D46: ALL | E46: CAP-FXD 4700PF +-20% 250V CER X5V | F46: 0160-7049 | H46: 28480 | J46: 4700p | K46: +-20% | L46: 250V | M46: CER | N46: X5V | O46: Y rated | P46: disc, blue
A47: C58 | B47: 1 | C47: of:=4*[.B47] -> 4 | D47: ALL | E47: CAP-FXD 0.1UF +-20% 250V PPR-MET | F47: 0160-4065 | H47: 28480 | J47: 0.1µ | K47: +-20% | L47: 250V | M47: PPR-MET | O47: X rated | P47: box, gold
A50: Resistors | J50: Resistance | K50: Tolerance | L50: Power Rating | M50: Type | N50: TC
A51: R42,44,54,56 | B51: 4 | C51: of:=2*[.B51] -> 8 | D51: 14,15 | E51: RESISTOR 10 +-1% .125W TF TC=0+-100 | F51: 0757-0346 | H51: 28480 | J51: 10 | K51: +-1% | L51: 0.125W | M51: TF | N51: 0+-100
A52: R90 | B52: 1 | C52: of:=4*[.B52] -> 4 | D52: ALL | E52: RESISTOR 10 +-1% .125W TF TC=0+-100 | F52: 0757-0346 | H52: 28480 | J52: 10 | K52: +-1% | L52: 0.125W | M52: TF | N52: 0+-100
A53: R77 | B53: 1 | C53: of:=2*[.B53] -> 2 | D53: 14,15 | E53: RESISTOR 21.5 +-1% .125W TF TC=0+-100 | F53: 0698-3430 | H53: 28480 | J53: 21.5 | K53: +-1% | L53: 0.125W | M53: TF | N53: 0+-100
A54: R77 | B54: 1 | C54: of:=2*[.B54] -> 2 | D54: 16,17 | E54: RESISTOR 56.2 +-1% .125W TF TC=0+-100 | F54: 0757-0395 | H54: 28480 | J54: 56.2 | K54: +-1% | L54: 0.125W | M54: TF | N54: 0+-100
A55: R5,6,80 | B55: 3 | C55: of:=4*[.B55] -> 12 | D55: ALL | E55: RESISTOR 100 +-1% .125W TF TC=0+-100 | F55: 0757-0401 | H55: 28480 | J55: 100 | K55: +-1% | L55: 0.125W | M55: TF | N55: 0+-100
A56: R43,45,55,57 | B56: 4 | C56: of:=2*[.B56] -> 8 | D56: 14,15 | E56: RESISTOR 100 +-1% .125W TF TC=0+-100 | F56: 0757-0401 | H56: 28480 | J56: 100 | K56: +-1% | L56: 0.125W | M56: TF | N56: 0+-100
A57: R126 | B57: 1 | C57: of:=4*[.B57] -> 4 | D57: ALL | E57: RESISTOR 100 +-1% .125W TF TC=0+-100 | F57: 0757-0401 | H57: 28480 | J57: 100 | K57: +-1% | L57: 0.125W | M57: TF | N57: 0+-100
A58: R42,44,54,56 | B58: 4 | C58: of:=2*[.B58] -> 8 | D58: 16,17 | E58: RESISTOR 147 +-1% .125W TF TC=0+-100 | F58: 0698-3438 | H58: 28480 | J58: 147 | K58: +-1% | L58: 0.125W | M58: TF | N58: 0+-100
A59: R102 | B59: 1 | C59: of:=4*[.B59] -> 4 | D59: ALL | E59: RESISTOR 147 +-1% .125W TF TC=0+-100 | F59: 0698-3438 | H59: 28480 | J59: 147 | K59: +-1% | L59: 0.125W | M59: TF | N59: 0+-100
A60: R118 | B60: 1 | C60: of:=4*[.B60] -> 4 | D60: ALL | E60: RESISTOR 178 +-1% .125W TF TC=0+-100 | F60: 0698-8678 | H60: 28480 | J60: 178 | K60: +-1% | L60: 0.125W | M60: TF | N60: 0+-100
A61: R101 | B61: 1 | C61: of:=4*[.B61] -> 4 | D61: ALL | E61: RESISTOR 215 +-1% .125W TF TC=0+-100 | F61: 0698-3441 | H61: 28480 | J61: 215 | K61: +-1% | L61: 0.125W | M61: TF | N61: 0+-100
A62: R87 | B62: 1 | C62: of:=4*[.B62] -> 4 | D62: ALL | E62: RESISTOR 316 +-1% .125W TF TC=0+-100 | F62: 0698-3444 | H62: 28480 | J62: 316 | K62: +-1% | L62: 0.125W | M62: TF | N62: 0+-100
A63: R47,50 | B63: 2 | C63: of:=2*[.B63] -> 4 | D63: 14,15 | E63: RESISTOR 499 +-1% .125W TF TC=0+-100 | F63: 0698-4123 | H63: 28480 | J63: 499 | K63: +-1% | L63: 0.125W | M63: TF | N63: 0+-100
A64: R100 | B64: 1 | C64: of:=4*[.B64] -> 4 | D64: ALL | E64: RESISTOR 499 +-1% .125W TF TC=0+-100 | F64: 0698-4123 | H64: 28480 | J64: 499 | K64: +-1% | L64: 0.125W | M64: TF | N64: 0+-100
A65: R8,9,12 | B65: 3 | C65: of:=2*[.B65] -> 6 | D65: 14,15 | E65: RESISTOR 1K +-1% .125W TF TC=0+-100 | F65: 0757-0280 | H65: 28480 | J65: 1k | K65: +-1% | L65: 0.125W | M65: TF | N65: 0+-100
A66: R17,18,66,78,110,123 | B66: 6 | C66: of:=4*[.B66] -> 24 | D66: ALL | E66: RESISTOR 1K +-1% .125W TF TC=0+-100 | F66: 0757-0280 | H66: 28480 | J66: 1k | K66: +-1% | L66: 0.125W | M66: TF | N66: 0+-100
A67: R65 | B67: 1 | C67: of:=4*[.B67] -> 4 | D67: ALL | E67: RESISTOR 1.21K +-1%.125W TF TC=0+-100 | F67: 0757-0274 | H67: 28480 | J67: 1.21k | K67: +-1% | L67: 0.125W | M67: TF | N67: 0+-100
A68: R103 | B68: 1 | C68: of:=4*[.B68] -> 4 | D68: ALL | E68: RESISTOR 1.62K +-1% .125W TF TC=0+-100 | F68: 0757-0428 | H68: 28480 | J68: 1.62k | K68: +-1% | L68: 0.125W | M68: TF | N68: 0+-100
A69: R19,113 | B69: 2 | C69: of:=4*[.B69] -> 8 | D69: ALL | E69: RESISTOR 1.96K +-1% .125W TF TC=0+-100 | F69: 0698-0083 | H69: 28480 | J69: 1.96k | K69: +-1% | L69: 0.125W | M69: TF | N69: 0+-100
A70: R43,55 | B70: 2 | C70: of:=2*[.B70] -> 4 | D70: 16,17 | E70: RESISTOR 1.96K +-1% .125W TF TC=0+-100 | F70: 0757-0293 | H70: 28480 | J70: 1.96k | K70: +-1% | L70: 0.125W | M70: TF | N70: 0+-100
A71: R49,51 | B71: 2 | C71: of:=2*[.B71] -> 4 | D71: 14,15 | E71: RESISTOR 1.96K +-1% .125W TF TC=0+-100 | F71: 0757-0293 | H71: 28480 | J71: 1.96k | K71: +-1% | L71: 0.125W | M71: TF | N71: 0+-100
A72: R31,32,35 | B72: 3 | C72: of:=4*[.B72] -> 12 | D72: ALL | E72: RESISTOR 2.15K +-1% .125W TF TC=0+-100 | F72: 0698-0084 | H72: 28480 | J72: 2.15k | K72: +-1% | L72: 0.125W | M72: TF | N72: 0+-100
A73: R40 | B73: 1 | C73: of:=1*[.B73] -> 1 | D73: 14 | E73: RESISTOR 2.43K +-1% .125W TF TC=0+-100 | F73: 0757-0431 | H73: 28480 | J73: 2.43k | K73: +-1% | L73: 0.125W | M73: TF | N73: 0+-100
A74: R61 | B74: 1 | C74: of:=4*[.B74] -> 4 | D74: ALL | E74: RESISTOR 2.61K +-1% .125W TF TC=0+-100 | F74: 0698-0085 | H74: 28480 | J74: 2.61k | K74: +-1% | L74: 0.125W | M74: TF | N74: 0+-100
A75: R40 | B75: 1 | C75: of:=1*[.B75] -> 1 | D75: 15 | E75: RESISTOR 3.09K +-1% .125W TF TC=0+-100 | F75: 0698-4438 | H75: 28480 | J75: 3.09k | K75: +-1% | L75: 0.125W | M75: TF | N75: 0+-100
A76: R109 | B76: 1 | C76: of:=4*[.B76] -> 4 | D76: ALL | E76: RESISTOR 3.83K +-1% .125W TF TC=0+-100 | F76: 0698-3153 | H76: 28480 | J76: 3.83k | K76: +-1% | L76: 0.125W | M76: TF | N76: 0+-100
A77: R67 | B77: 1 | C77: of:=4*[.B77] -> 4 | D77: ALL | E77: RESISTOR 5.11K +-1% .125W TF TC=0+-100 | F77: 0757-0438 | H77: 28480 | J77: 5.11k | K77: +-1% | L77: 0.125W | M77: TF | N77: 0+-100
A78: R40 | B78: 1 | C78: of:=1*[.B78] -> 1 | D78: 16 | E78: RESISTOR 5.23K +-1% .125W TF TC=0+-100 | F78: 0698-0063 | H78: 28480 | J78: 5.23k | K78: +-1% | L78: 0.125W | M78: TF | N78: 0+-100
A79: R72 | B79: 1 | C79: of:=1*[.B79] -> 1 | D79: 15 | E79: RESISTOR 6.19K +-1% .125W TF TC=0+-100 | F79: 0757-0290 | H79: 28480 | J79: 6.19k | K79: +-1% | L79: 0.125W | M79: TF | N79: 0+-100
A80: R36 | B80: 1 | C80: of:=1*[.B80] -> 1 | D80: 15 | E80: RESISTOR 6.81K +-1% .125W TF TC=0+-100 | F80: 0757-0439 | H80: 28480 | J80: 6.81k | K80: +-1% | L80: 0.125W | M80: TF | N80: 0+-100
A81: R40 | B81: 1 | C81: of:=1*[.B81] -> 1 | D81: 17 | E81: RESISTOR 6.81K +-1% .125W TF TC=0+-100 | F81: 0757-0439 | H81: 28480 | J81: 6.81k | K81: +-1% | L81: 0.125W | M81: TF | N81: 0+-100
A82: R39 | B82: 1 | C82: of:=1*[.B82] -> 1 | D82: 15 | E82: RESISTOR 7.15K +-1% .125W TF TC=0+-100 | F82: 0698-4471 | H82: 28480 | J82: 7.15k | K82: +-1% | L82: 0.125W | M82: TF | N82: 0+-100
A83: R36 | B83: 1 | C83: of:=1*[.B83] -> 1 | D83: 14 | E83: RESISTOR 7.32K +-1% .125W TF TC=0+-100 | F83: 0698-3518 | H83: 28480 | J83: 7.32k | K83: +-1% | L83: 0.125W | M83: TF | N83: 0+-100
A84: R39 | B84: 1 | C84: of:=1*[.B84] -> 1 | D84: 14 | E84: RESISTOR 7.5K +-1% .125W TF TC=0+-100 | F84: 0757-0440 | H84: 28480 | J84: 7.5k | K84: +-1% | L84: 0.125W | M84: TF | N84: 0+-100
A85: R83,119 | B85: 2 | C85: of:=4*[.B85] -> 8 | D85: ALL | E85: RESISTOR 7.5K +-1% .125W TF TC=0+-100 | F85: 0757-0440 | H85: 28480 | J85: 7.5k | K85: +-1% | L85: 0.125W | M85: TF | N85: 0+-100
A86: R41 | B86: 1 | C86: of:=1*[.B86] -> 1 | D86: 14 | E86: RESISTOR 8.06K +-1% .125W TF TC=0+-100 | F86: 0698-4473 | H86: 28480 | J86: 8.06k | K86: +-1% | L86: 0.125W | M86: TF | N86: 0+-100
A87: R36 | B87: 1 | C87: of:=1*[.B87] -> 1 | D87: 16 | E87: RESISTOR 8.25K +-1% .125W TF TC=0+-100 | F87: 0757-0441 | H87: 28480 | J87: 8.25k | K87: +-1% | L87: 0.125W | M87: TF | N87: 0+-100
A88: R39 | B88: 1 | C88: of:=1*[.B88] -> 1 | D88: 16 | E88: RESISTOR 8.66K +-1% .125W TF TC=0+-100 | F88: 0698-3498 | H88: 28480 | J88: 8.66k | K88: +-1% | L88: 0.125W | M88: TF | N88: 0+-100
A89: R34 | B89: 1 | C89: of:=4*[.B89] -> 4 | D89: ALL | E89: RESISTOR 9.09K +-1% .125W TF TC=0+-100 | F89: 0757-0288 | H89: 28480 | J89: 9.09k | K89: +-1% | L89: 0.125W | M89: TF | N89: 0+-100
A90: R36 | B90: 1 | C90: of:=1*[.B90] -> 1 | D90: 17 | E90: RESISTOR 9.53K +-1% .125W TF TC=0+-100 | F90: 0698-8580 | H90: 28480 | J90: 9.53k | K90: +-1% | L90: 0.125W | M90: TF | N90: 0+-100
A91: R15 | B91: 1 | C91: of:=2*[.B91] -> 2 | D91: 14,15 | E91: RESISTOR 10K +-1% .125W TF TC=0+-100 | F91: 0757-0442 | H91: 28480 | J91: 10k | K91: +-1% | L91: 0.125W | M91: TF | N91: 0+-100
A92: R24,26,27,37,38,64,88,117,120 | B92: 9 | C92: of:=4*[.B92] -> 36 | D92: ALL | E92: RESISTOR 10K +-1% .125W TF TC=0+-100 | F92: 0757-0442 | H92: 28480 | J92: 10k | K92: +-1% | L92: 0.125W | M92: TF | N92: 0+-100
A93: R39 | B93: 1 | C93: of:=1*[.B93] -> 1 | D93: 17 | E93: RESISTOR 10K +-1% .125W TF TC=0+-100 | F93: 0757-0442 | H93: 28480 | J93: 10k | K93: +-1% | L93: 0.125W | M93: TF | N93: 0+-100
A94: R74,75 | B94: 2 | C94: of:=2*[.B94] -> 4 | D94: 14,15 | E94: RESISTOR 12.1K +-1% .125W TF TC=0+-100 | F94: 0757-0444 | H94: 28480 | J94: 12.1k | K94: +-1% | L94: 0.125W | M94: TF | N94: 0+-100
A95: R72 | B95: 1 | C95: of:=1*[.B95] -> 1 | D95: 14 | E95: RESISTOR 13.3K +-1% .125W TF TC=0+-100 | F95: 0757-0289 | H95: 28480 | J95: 13.3k | K95: +-1% | L95: 0.125W | M95: TF | N95: 0+-100
A96: R93 | B96: 1 | C96: of:=4*[.B96] -> 4 | D96: ALL | E96: RESISTOR 13.7K +-1% .125W TF TC=0+-100 | F96: 0698-3581 | H96: 28480 | J96: 13.7k | K96: +-1% | L96: 0.125W | M96: TF | N96: 0+-100
A97: R104,107 | B97: 2 | C97: of:=4*[.B97] -> 8 | D97: ALL | E97: RESISTOR 14.7K +-1% .125W TF TC=+-100 | F97: 0698-3156 | H97: 28480 | J97: 14.7k | K97: +-1% | L97: 0.125W | M97: TF | N97: 0+-100
A98: R74,75 | B98: 2 | C98: of:=1*[.B98] -> 2 | D98: 17 | E98: RESISTOR 17.8K +-1% .125W TF TC=0+-100 | F98: 0698-3136 | H98: 28480 | J98: 17.8k | K98: +-1% | L98: 0.125W | M98: TF | N98: 0+-100
A99: R14,48,52 | B99: 3 | C99: of:=2*[.B99] -> 6 | D99: 14,15 | E99: RESISTOR 19.6K +-1% .125W TF TC=0+-100 | F99: 0698-3157 | H99: 28480 | J99: 19.6k | K99: +-1% | L99: 0.125W | M99: TF | N99: 0+-100
A100: R81,122 | B100: 2 | C100: of:=4*[.B100] -> 8 | D100: ALL | E100: RESISTOR 19.6K +-1% .125W TF TC=0+-100 | F100: 0698-3157 | H100: 28480 | J100: 19.6k | K100: +-1% | L100: 0.125W | M100: TF | N100: 0+-100
A101: R74,75 | B101: 2 | C101: of:=1*[.B101] -> 2 | D101: 16 | E101: RESISTOR 20.5K +-1% .125W TF TC=0+-100 | F101: 0698-3245 | H101: 28480 | J101: 20.5k | K101: +-1% | L101: 0.125W | M101: TF | N101: 0+-100
A102: R70 | B102: 1 | C102: of:=1*[.B102] -> 1 | D102: 16 | E102: RESISTOR 23.7K +-1% .125W TF TC=0+-100 | F102: 0698-3158 | H102: 28480 | J102: 23.7k | K102: +-1% | L102: 0.125W | M102: TF | N102: 0+-100
A103: R72 | B103: 1 | C103: of:=1*[.B103] -> 1 | D103: 17 | E103: RESISTOR 26.1K +-1% .125W TF TC=0+-100 | F103: 0698-8123 | H103: 28480 | J103: 26.1k | K103: +-1% | L103: 0.125W | M103: TF | N103: 0+-100
A104: R82 | B104: 1 | C104: of:=2*[.B104] -> 2 | D104: 14,15 | E104: RESISTOR 26.1K +-1% .125W TF TC=0+-100 | F104: 0698-8123 | H104: 28480 | J104: 26.1k | K104: +-1% | L104: 0.125W | M104: TF | N104: 0+-100
A105: R116 | B105: 1 | C105: of:=1*[.B105] -> 1 | D105: 14 | E105: RESISTOR 28K +-1% .125W TF TC=0+-100 | F105: 0698-4489 | H105: 28480 | J105: 28k | K105: +-1% | L105: 0.125W | M105: TF | N105: 0+-100
A106: R3,7,21,22,105,106 | B106: 6 | C106: of:=4*[.B106] -> 24 | D106: ALL | E106: RESISTOR 31.6K +-1% .125W TF TC=0+-100 | F106: 0698-3160 | H106: 28480 | J106: 31.6k | K106: +-1% | L106: 0.125W | M106: TF | N106: 0+-100
A107: R98 | B107: 1 | C107: of:=1*[.B107] -> 1 | D107: 17 | E107: RESISTOR 31.6K +-1% .125W TF TC=0+-100 | F107: 0698-3160 | H107: 28480 | J107: 31.6k | K107: +-1% | L107: 0.125W | M107: TF | N107: 0+-100
A108: R41 | B108: 1 | C108: of:=1*[.B108] -> 1 | D108: 15 | E108: RESISTOR 33.2K +-1% .125W TF TC=0+-100 | F108: 0757-0454 | H108: 28480 | J108: 33.2k | K108: +-1% | L108: 0.125W | M108: TF | N108: 0+-100
A109: R116 | B109: 1 | C109: of:=1*[.B109] -> 1 | D109: 17 | E109: RESISTOR 35.7K +-1% .125W TF TC=0+-100 | F109: 0698-4494 | H109: 28480 | J109: 35.7k | K109: +-1% | L109: 0.125W | M109: TF | N109: 0+-100
A110: R116 | B110: 1 | C110: of:=2*[.B110] -> 2 | D110: 15,16 | E110: RESISTOR 38.3K +-1% .125W TF TC=0+-100 | F110: 0698-3161 | H110: 28480 | J110: 38.3k | K110: +-1% | L110: 0.125W | M110: TF | N110: 0+-100
A111: R62 | B111: 1 | C111: of:=1*[.B111] -> 1 | D111: 14 | E111: RESISTOR 42.2K +-1% .125W TF TC=0+-100 | F111: 0698-7634 | H111: 28480 | J111: 42.2k | K111: +-1% | L111: 0.125W | M111: TF | N111: 0+-100
A112: R29,68,86,89,91,92,95,96,99,114,121 | B112: 11 | C112: of:=4*[.B112] -> 44 | D112: ALL | E112: RESISTOR 46.4K +-1% .125W TF TC=0+-100 | F112: 0698-3162 | H112: 28480 | J112: 46.4k | K112: +-1% | L112: 0.125W | M112: TF | N112: 0+-100
A113: R28,111 | B113: 2 | C113: of:=4*[.B113] -> 8 | D113: ALL | E113: RESISTOR 49.9K +-1% .125W TF TC=0+-100 | F113: 0698-3228 | H113: 28480 | J113: 49.9k | K113: +-1% | L113: 0.125W | M113: TF | N113: 0+-100
A114: R72 | B114: 1 | C114: of:=1*[.B114] -> 1 | D114: 16 | E114: RESISTOR 51.1K +-1% .125W TF TC=0+-100 | F114: 0757-0458 | H114: 28480 | J114: 51.1k | K114: +-1% | L114: 0.125W | M114: TF | N114: 0+-100
A115: R41 | B115: 1 | C115: of:=1*[.B115] -> 1 | D115: 16 | E115: RESISTOR 66.5K +-1% .125W TF TC=0+-100 | F115: 0698-4503 | H115: 28480 | J115: 66.5k | K115: +-1% | L115: 0.125W | M115: TF | N115: 0+-100
A116: R13 | B116: 1 | C116: of:=2*[.B116] -> 2 | D116: 14,15 | E116: RESISTOR 68.1K +-1% .125W TF TC=0+-100 | F116: 0757-0461 | H116: 28480 | J116: 68.1k | K116: +-1% | L116: 0.125W | M116: TF | N116: 0+-100
A117: R82 | B117: 1 | C117: of:=2*[.B117] -> 2 | D117: 16,17 | E117: RESISTOR 68.1K +-1% .125W TF TC=0+-100 | F117: 0757-0461 | H117: 28480 | J117: 68.1k | K117: +-1% | L117: 0.125W | M117: TF | N117: 0+-100
A118: R98 | B118: 1 | C118: of:=1*[.B118] -> 1 | D118: 16 | E118: RESISTOR 68.1K +-1% .125W TF TC=0+-100 | F118: 0757-0461 | H118: 28480 | J118: 68.1k | K118: +-1% | L118: 0.125W | M118: TF | N118: 0+-100
A119: R115 | B119: 1 | C119: of:=1*[.B119] -> 1 | D119: 17 | E119: RESISTOR 68.1K +-1% .125W TF TC=0+-100 | F119: 0757-0461 | H119: 28480 | J119: 68.1k | K119: +-1% | L119: 0.125W | M119: TF | N119: 0+-100
A120: R115 | B120: 1 | C120: of:=1*[.B120] -> 1 | D120: 14 | E120: RESISTOR 75K +-1% .125W TF TC=0+-100 | F120: 0757-0462 | H120: 28480 | J120: 75k | K120: +-1% | L120: 0.125W | M120: TF | N120: 0+-100
A121: R115 | B121: 1 | C121: of:=1*[.B121] -> 1 | D121: 16 | E121: RESISTOR 75K +-1% .125W TF TC=0+-100 | F121: 0757-0462 | H121: 28480 | J121: 75k | K121: +-1% | L121: 0.125W | M121: TF | N121: 0+-100
A122: R20,23 | B122: 2 | C122: of:=4*[.B122] -> 8 | D122: ALL | E122: RESISTOR 82.5K +-1% .125W TF TC=0+-100 | F122: 0757-0463 | H122: 28480 | J122: 82.5k | K122: +-1% | L122: 0.125W | M122: TF | N122: 0+-100
A123: R115 | B123: 1 | C123: of:=1*[.B123] -> 1 | D123: 15 | E123: RESISTOR 82.5K +-1% .125W TF TC=0+-100 | F123: 0757-0463 | H123: 28480 | J123: 82.5k | K123: +-1% | L123: 0.125W | M123: TF | N123: 0+-100
A124: R4,71,73,76,112 | B124: 5 | C124: of:=4*[.B124] -> 20 | D124: ALL | E124: RESISTOR 100K +-1% .125W TF TC=0+-100 | F124: 0757-0465 | H124: 28480 | J124: 100k | K124: +-1% | L124: 0.125W | M124: TF | N124: 0+-100
A125: R16 | B125: 1 | C125: of:=2*[.B125] -> 2 | D125: 14,15 | E125: RESISTOR 100K +-1% .125W TF TC=0+-100 | F125: 0757-0465 | H125: 28480 | J125: 100k | K125: +-1% | L125: 0.125W | M125: TF | N125: 0+-100
A126: R70 | B126: 1 | C126: of:=1*[.B126] -> 1 | D126: 17 | E126: RESISTOR 100K +-1% .125W TF TC=0+-100 | F126: 0757-0465 | H126: 28480 | J126: 100k | K126: +-1% | L126: 0.125W | M126: TF | N126: 0+-100
A127: R98 | B127: 1 | C127: of:=1*[.B127] -> 1 | D127: 15 | E127: RESISTOR 100K +-1% .125W TF TC=0+-100 | F127: 0757-0465 | H127: 28480 | J127: 100k | K127: +-1% | L127: 0.125W | M127: TF | N127: 0+-100
A128: R62 | B128: 1 | C128: of:=1*[.B128] -> 1 | D128: 15 | E128: RESISTOR 105K +-1% .125W TF TC=0+-100 | F128: 0698-4514 | H128: 28480 | J128: 105k | K128: +-1% | L128: 0.125W | M128: TF | N128: 0+-100
A129: R41 | B129: 1 | C129: of:=1*[.B129] -> 1 | D129: 17 | E129: RESISTOR 121K +-1% .125W TF TC=0+-100 | F129: 0757-0467 | H129: 28480 | J129: 121k | K129: +-1% | L129: 0.125W | M129: TF | N129: 0+-100
A130: R79 | B130: 1 | C130: of:=1*[.B130] -> 1 | D130: 14 | E130: RESISTOR 147K +-1% .125W TF TC=0+-100 | F130: 0698-4767 | H130: 28480 | J130: 147k | K130: +-1% | L130: 0.125W | M130: TF | N130: 0+-100
A131: R70 | B131: 1 | C131: of:=1*[.B131] -> 1 | D131: 14 | E131: RESISTOR 178K +-1% .125W TF TC=0+-100 | F131: 0698-3243 | H131: 28480 | J131: 178k | K131: +-1% | L131: 0.125W | M131: TF | N131: 0+-100
A132: R98 | B132: 1 | C132: of:=1*[.B132] -> 1 | D132: 14 | E132: RESISTOR 261K +-1% .125W TF TC=0+-100 | F132: 0698-3455 | H132: 28480 | J132: 261k | K132: +-1% | L132: 0.125W | M132: TF | N132: 0+-100
A133: R70 | B133: 1 | C133: of:=1*[.B133] -> 1 | D133: 15 | E133: RESISTOR 383K +-1% .125W TF TC=0+-100 | F133: 0698-3459 | H133: 28480 | J133: 383k | K133: +-1% | L133: 0.125W | M133: TF | N133: 0+-100
A134: R79 | B134: 1 | C134: of:=1*[.B134] -> 1 | D134: 15 | E134: RESISTOR 422K +-1% .125W TF TC=0+-100 | F134: 0698-3460 | H134: 28480 | J134: 422k | K134: +-1% | L134: 0.125W | M134: TF | N134: 0+-100
A135: R62 | B135: 1 | C135: of:=1*[.B135] -> 1 | D135: 16 | E135: RESISTOR 475K +-1% .125W TF TC=0+-100 | F135: 0757-0481 | H135: 28480 | J135: 475k | K135: +-1% | L135: 0.125W | M135: TF | N135: 0+-100
A136: R25,30,33 | B136: 3 | C136: of:=4*[.B136] -> 12 | D136: ALL | E136: RESISTOR 562K +-1% .125W TF TC=0+-100 | F136: 0698-8824 | H136: 28480 | J136: 562k | K136: +-1% | L136: 0.125W | M136: TF | N136: 0+-100
A137: R79 | B137: 1 | C137: of:=1*[.B137] -> 1 | D137: 16 | E137: RESISTOR 681K +-1% .125W TF TC=0+-100 | F137: 0698-8825 | H137: 28480 | J137: 681k | K137: +-1% | L137: 0.125W | M137: TF | N137: 0+-100
A138: R125 | B138: 1 | C138: of:=2*[.B138] -> 2 | D138: 16,17 | E138: RESISTOR 681K +-1% .125W TF TC=0+-100 | F138: 0698-8825 | H138: 28480 | J138: 681k | K138: +-1% | L138: 0.125W | M138: TF | N138: 0+-100
A139: R62 | B139: 1 | C139: of:=1*[.B139] -> 1 | D139: 17 | E139: RESISTOR 825K +-1% .125W TF TC=0+-100 | F139: 0698-8826 | H139: 28480 | J139: 825k | K139: +-1% | L139: 0.125W | M139: TF | N139: 0+-100
A140: R63 | B140: 1 | C140: of:=4*[.B140] -> 4 | D140: ALL | E140: RESISTOR 1M +-1% .125W TF TC=0+-100 | F140: 0698-8827 | H140: 28480 | J140: 1M | K140: +-1% | L140: 0.125W | M140: TF | N140: 0+-100
A141: R79 | B141: 1 | C141: of:=1*[.B141] -> 1 | D141: 17 | E141: RESISTOR 1M +-1% .125W TF TC=0+-100 | F141: 0698-8827 | H141: 28480 | J141: 1M | K141: +-1% | L141: 0.125W | M141: TF | N141: 0+-100
A143: R124 | B143: 1 | C143: of:=2*[.B143] -> 2 | D143: 16,17 | E143: RESISTOR 1 +-1% .125W TF TC=0+-100 | F143: 0698-8812 | H143: 28480 | J143: 1 | K143: +-1% | L143: 0.125W | M143: TF | N143: 0+-100
A144: R46,53 | B144: 2 | C144: of:=2*[.B144] -> 4 | D144: 14,15 | E144: RESISTOR 10 +-1% .25W TF TC=0+-100 | F144: 0757-0489 | H144: 28480 | J144: 10 | K144: +-1% | L144: 0.25W | M144: TF | N144: 0+-100
A145: R8,9 | B145: 2 | C145: of:=2*[.B145] -> 4 | D145: 16,17 | E145: RESISTOR 1K +-5% 1W TF TC=0+-100 | F145: 0761-0021 | H145: 28480 | J145: 1k | K145: +-5% | L145: 1W | M145: TF | N145: 0+-100
A147: R11 | B147: 1 | C147: of:=1*[.B147] -> 1 | D147: 14 | E147: RESISTOR 2K +-5% 3W PWI 20PPM | F147: 0811-1806 | H147: 28480 | J147: 2k | K147: +-5% | L147: 3W | M147: PWI | N147: 0+-20PPM
A148: R11 | B148: 1 | C148: of:=1*[.B148] -> 1 | D148: 15 | E148: RESISTOR 5K +-5% 3W PWI 20PPM | F148: 0811-2188 | H148: 28480 | J148: 5k | K148: +-5% | L148: 3W | M148: PWI | N148: 0+-20PPM | P148: axial 800
A149: R11 | B149: 1 | C149: of:=1*[.B149] -> 1 | D149: 16 | E149: RESISTOR 27K +-5% 2W MO TC=0+-200PPM | F149: 0764-0007 | H149: 28480 | J149: 27k | K149: +-5% | L149: 2W | M149: MO | N149: 0+-200PPM
A150: R11 | B150: 1 | C150: of:=1*[.B150] -> 1 | D150: 17 | E150: RESISTOR 45K +-5% 2W MO TC=0+-500PPM | F150: 0699-3105 | H150: 28480 | J150: 45k | K150: +-5% | L150: 2W | M150: MO | N150: 0+-500PPM
A152: R60 | B152: 1 | C152: of:=1*[.B152] -> 1 | D152: 14 | E152: RESISTOR 390 +-5% 3W PWI TC=0+-20 | F152: 0811-1799 | H152: 28480 | J152: 390 | K152: +-5% | L152: 3W | M152: PWI | N152: 0+-20
A153: R60 | B153: 1 | C153: of:=1*[.B153] -> 1 | D153: 15 | E153: RESISTOR 1K +-5% 3W PWI TC=0+-20 | F153: 0813-0001 | H153: 28480 | J153: 1k | K153: +-5% | L153: 3W | M153: PWI | N153: 0+-20 | P153: axial 800
A154: R60 | B154: 1 | C154: of:=1*[.B154] -> 1 | D154: 16 | E154: RESISTOR 1.52K +-5% 3W PWI TC=0+-20 | F154: 0811-0071 | H154: 28480 | J154: 1.52k | K154: +-5% | L154: 3W | M154: PWI | N154: 0+-20
A155: R60 | B155: 1 | C155: of:=1*[.B155] -> 1 | D155: 17 | E155: RESISTOR 2.6K +-5% 3W PWI TC=0+-20 | F155: 0811-1808 | H155: 28480 | J155: 2.6k | K155: +-5% | L155: 3W | M155: PWI | N155: 0+-20
A157: R1,2 | B157: 2 | C157: of:=1*[.B157] -> 2 | D157: 14 | E157: RESISTOR 0.1 +-1% 5W PWN TC=0+-90 | F157: 0811-3478 | H157: 28480 | J157: 0.1 | K157: +-1% | L157: 5W | M157: PWN | N157: 0+-90
A158: R1,2 | B158: 2 | C158: of:=1*[.B158] -> 2 | D158: 15 | E158: RESISTOR 0.2 +-1% 5W PWN TC=0+-90 | F158: 0811-3839 | H158: 28480 | J158: 0.2 | K158: +-1% | L158: 5W | M158: PWN | N158: 0+-90 | P158: axial 1200
A159: R1,2 | B159: 2 | C159: of:=1*[.B159] -> 2 | D159: 16 | E159: RESISTOR 0.6 +-5% 5W PWN TC=0+-90 | F159: 0811-3864 | H159: 28480 | J159: 0.6 | K159: +-5% | L159: 5W | M159: PWN | N159: 0+-90
A160: R1,2 | B160: 2 | C160: of:=1*[.B160] -> 2 | D160: 17 | E160: RESISTOR 1.78 +-1% 5W PWN TC=0+-90 | F160: 0811-3861 | H160: 28480 | J160: 1.78 | K160: +-1% | L160: 5W | M160: PWN | N160: 0+-90
A162: R58,59 | B162: 2 | C162: of:=1*[.B162] -> 2 | D162: 14 | E162: RESISTOR 0.2 +-1% 10W PWN TC=0+-90 | F162: 0811-3909 | H162: 28480 | J162: 0.2 | K162: +-1% | L162: 10W | M162: PWN | N162: 0+-90 | P162: axial 2000
A163: R58 | B163: 1 | C163: of:=1*[.B163] -> 1 | D163: 15 | E163: RESISTOR 0.2 +-1% 10W PWN TC=0+-90 | F163: 0811-3909 | H163: 28480 | J163: 0.2 | K163: +-1% | L163: 10W | M163: PWN | N163: 0+-90
A164: R58 | B164: 1 | C164: of:=1*[.B164] -> 1 | D164: 16 | E164: RESISTOR 0.6 +-1% 10W PWN TC=0+-90 | F164: 0811-4118 | H164: 28480 | J164: 0.6 | K164: +-1% | L164: 10W | M164: PWN | N164: 0+-90
A165: R58,59 | B165: 2 | C165: of:=1*[.B165] -> 2 | D165: 17 | E165: RESISTOR 1.78 +-1% 5W PWN TC=0+-90 | F165: 0811-3861 | H165: 28480 | J165: 1.78 | K165: +-1% | L165: 5W | M165: PWN | N165: 0+-90
A167: Alternatives
A168: R1,2 | B168: 2 | C168: of:=1*[.B168] -> 2 | D168: 16 | E168: RESISTOR 1.5 +-1% 5W PWN TC=0+-90 | F168: 0811-3864 | H168: 28480 | J168: 1 | K168: +-1% | L168: 5W | M168: PWN | N168: 0+-90
A169: R58,59 | B169: 2 | C169: of:=1*[.B169] -> 2 | D169: 16 | E169: RESISTOR 1.5 +-1% 5W PWN TC=0+-90 | F169: 0811-4118 | H169: 28480 | J169: 1 | K169: +-1% | L169: 10W | M169: PWN | N169: 0+-90
A170: R74,75 | B170: 2 | C170: of:=1*[.B170] -> 2 | D170: 16 | E170: RESISTOR 16.9K +-1% .125W TF TC=0+-100 | F170: 0757-0444 | H170: 28480 | J170: 16.9k | K170: +-1% | L170: 0.125W | M170: TF | N170: 0+-100
A171: R74,75 | B171: 2 | C171: of:=1*[.B171] -> 2 | D171: 16 | E171: RESISTOR 17.4K +-1% .125W TF TC=0+-100 | F171: 0757-0444 | H171: 28480 | J171: 17.4k | K171: +-1% | L171: 0.125W | M171: TF | N171: 0+-100
A173: R1,2 | B173: 2 | C173: of:=1*[.B173] -> 2 | D173: 17 | E173: RESISTOR 2 +-1% 5W PWN TC=0+-90 | F173: 0811-3861 | H173: 28480 | J173: 2 | K173: +-1% | L173: 5W | M173: PWN | N173: 0+-90
A174: R58,59 | B174: 2 | C174: of:=1*[.B174] -> 2 | D174: 17 | E174: RESISTOR 2 +-1% 5W PWN TC=0+-90 | F174: 0811-3861 | H174: 28480 | J174: 2 | K174: +-1% | L174: 5W | M174: PWN | N174: 0+-90
A175: R74,75 | B175: 2 | C175: of:=1*[.B175] -> 2 | D175: 17 | E175: RESISTOR 20K +-1% .125W TF TC=0+-100 | F175: 0698-3245 | H175: 28480 | J175: 20k | K175: +-1% | L175: 0.125W | M175: TF | N175: 0+-100
A177: R1,2 | B177: 2 | C177: of:=1*[.B177] -> 2 | D177: 16 | E177: RESISTOR 0.604 +-1% 5W PWN TC=0+-90 | F177: 0811-3864 | H177: 28480 | J177: 0.604 | K177: +-1% | L177: 5W | M177: PWN | N177: 0+-90
A178: R58 | B178: 1 | C178: of:=1*[.B178] -> 1 | D178: 16 | E178: RESISTOR 0.619 +-1% 10W PWN TC=0+-90 | F178: 0811-4118 | H178: 28480 | J178: 0.619 | K178: +-1% | L178: 10W | M178: PWN | N178: 0+-90
A179: R74,75 | B179: 2 | C179: of:=1*[.B179] -> 2 | D179: 16 | E179: RESISTOR 21K +-1% .125W TF TC=0+-100 | F179: 0757-0444 | H179: 28480 | J179: 21k | K179: +-1% | L179: 0.125W | M179: TF | N179: 0+-100
A180: R74,75 | B180: 2 | C180: of:=1*[.B180] -> 2 | D180: 16 | E180: RESISTOR 21.5K +-1% .125W TF TC=0+-100 | F180: 0757-0444 | H180: 28480 | J180: 21.5k | K180: +-1% | L180: 0.125W | M180: TF | N180: 0+-100
A182: R1,2 | B182: 2 | C182: of:=1*[.B182] -> 2 | D182: 17 | E182: RESISTOR 1.75 +-1% 5W PWN TC=0+-90 | F182: 0811-3861 | H182: 28480 | J182: 1.75 | K182: +-1% | L182: 5W | M182: PWN | N182: 0+-90
A183: R58,59 | B183: 2 | C183: of:=1*[.B183] -> 2 | D183: 17 | E183: RESISTOR 1.75 +-1% 5W PWN TC=0+-90 | F183: 0811-3861 | H183: 28480 | J183: 1.75 | K183: +-1% | L183: 5W | M183: PWN | N183: 0+-90
A184: R74,75 | B184: 2 | C184: of:=1*[.B184] -> 2 | D184: 17 | E184: RESISTOR 17.4K +-1% .125W TF TC=0+-100 | F184: 0698-3245 | H184: 28480 | J184: 17.4k | K184: +-1% | L184: 0.125W | M184: TF | N184: 0+-100
A185: R74,75 | B185: 2 | C185: of:=1*[.B185] -> 2 | D185: 17 | E185: RESISTOR 17.8K +-1% .125W TF TC=0+-100 | F185: 0698-3245 | H185: 28480 | J185: 17.8k | K185: +-1% | L185: 0.125W | M185: TF | N185: 0+-100
A188: Fusible Resistors
A189: R10,108 | B189: 2 | C189: of:=4*[.B189] -> 8 | D189: ALL | E189: RESISTOR-FUSE 1OHM +-5% 0.5W @70 | F189: 0699-2715 | H189: 28480
A190: Variable Resistors | J190: Mfr.
A191: R69 | B191: 1 | C191: of:=4*[.B191] -> 4 | D191: ALL | E191: RESISTOR-TRMR 50K 10% TKF TOP-ADJ 25-T | F191: 2100-4306 | H191: 32997 | J191: Bourns | K191: CC trim
A192: R84,85 | B192: 2 | C192: of:=4*[.B192] -> 8 | D192: ALL | E192: RES-VAR 10K 5% 10-TURN WW | F192: 2100-4503 | H192: 32997 | J192: Bourns | K192: CC,CV
A193: R94 | B193: 1 | C193: of:=4*[.B193] -> 4 | D193: ALL | E193: RESISTOR-VAR 10K +-10% | F193: 2100-4357 | H193: 32997 | J193: Bourns | K193: OVP
A194: R97 | B194: 1 | C194: of:=4*[.B194] -> 4 | D194: ALL | E194: RESISTOR-TRMR 10K 10% TKF TOP-ADJ 25-T | F194: 2100-4305 | H194: 32997 | J194: Bourns | K194: CV trim
A196: U1 | B196: 1 | C196: of:=4*[.B196] -> 4 | D196: ALL | E196: IC V RGLTR-FXD-POS 4.8/5.2V TO-220 PKG | F196: 1826-0144 | G196: MC7805CT | H196: 04713 | J196: Motorola | P196: to-220
A197: U2 | B197: 1 | C197: of:=2*[.B197] -> 2 | D197: 14,15 | E197: IC OP AMP GP DUAL 8 PIN DIP-P | F197: 1826-0346 | G197: LM358N | H197: 27014 | J197: National Semi | P197: dip-8
A198: U3,16,20 | B198: 3 | C198: of:=4*[.B198] -> 12 | D198: ALL | E198: IC COMPARATOR PRCN DUAL 8 PIN DIP-P | F198: 1826-0412 | G198: LM393N | H198: 27014 | J198: National Semi | P198: dip-8
A199: U4,5 | B199: 2 | C199: of:=4*[.B199] -> 8 | D199: ALL | E199: IC COMPARATOR GP QUAD 14 PIN DIP-P | F199: 1826-0138 | G199: LM339 | H199: 27014 | J199: National Semi | P199: dip-14
A200: U6,9 | B200: 2 | C200: of:=4*[.B200] -> 8 | D200: ALL | E200: IC OP AMP LOW-BIAS-H-IMPD QUAD 14 PIN | F200: 1826-0665 | G200: LF347BN | H200: 27014 | J200: National Semi | P200: dip-14
A201: U7,15,17 | B201: 3 | C201: of:=4*[.B201] -> 12 | D201: ALL | E201: IC V RGLTR-V-REF-FXD 4.8/5.2V TO-92 PKG | F201: 1826-1297 | G201: LM336BZ-5.0 | H201: 27014 | J201: National Semi | P201: to-92
A202: U8 | B202: 1 | C202: of:=4*[.B202] -> 4 | D202: ALL | E202: OPTO-ISOLATOR LED-TRIAC IF=100MA-MAX | F202: 1990-1659 | G202: MCP3020Z | H202: 14936 | J202: General Instruments | P202: dip-6, white
A203: U10 | B203: 1 | C203: of:=4*[.B203] -> 4 | D203: ALL | E203: IC OP AMP PRCN 8 PIN DIP-P | F203: 1826-1702 | G203: LT1055CNB | H203: 28480 | J203: HP | P203: dip-8
A204: U11 | B204: 1 | C204: of:=4*[.B204] -> 4 | D204: ALL | E204: IC OP AMP GP DUAL 8 PIN DIP-P | F204: 1826-1075 | G204: LF442CN | H204: 27014 | J204: National Semi | P204: dip-8
A205: U12 | B205: 1 | C205: of:=4*[.B205] -> 4 | D205: ALL | E205: IC V RGLTR-OV-V-SEN 2.3/37.8V 8-DIP-P | F205: 1826-0468 | G205: MC3423P1 | H205: 04713 | J205: Motorola | P205: dip-8
A206: U13 | B206: 1 | C206: of:=4*[.B206] -> 4 | D206: ALL | E206: IC V RGLTR-ADJ-POS 1.2/37V TO-220 PKG | F206: 1826-0393 | G206: LM317T | H206: 27014 | J206: National Semi | P206: to-220
A207: U14 | B207: 1 | C207: of:=4*[.B207] -> 4 | D207: ALL | E207: IC V RGLTR-FXD-NEG -11.5/-12.5V TO-220 | F207: 1826-0221 | G207: MC7912CT | H207: 04713 | J207: Motorola | P207: to-220
A208: U18 | B208: 1 | C208: of:=4*[.B208] -> 4 | D208: ALL | E208: IC OP AMP GP DUAL 8 PIN DIP-P | F208: 1826-0346 | G208: LM358N | H208: 27014 | J208: National Semi | P208: dip-8
A209: U19 | B209: 1 | C209: of:=4*[.B209] -> 4 | D209: ALL | E209: IC GATE TTL/LS NAND QUAD 2-INP | F209: 1820-1197 | G209: SN74LS00N | H209: 01295 | J209: TI | P209: dip-14
A210: U21,22,23,24 | B210: 4 | C210: of:=2*[.B210] -> 8 | D210: 16,17 | E210: OPTO-ISOLATOR LED-TRIAC IF=100MA-MAX | F210: 1990-1659 | G210: MCP3020Z | H210: 14936 | J210: General Instruments
A212: Q1,4 | B212: 2 | C212: of:=2*[.B212] -> 4 | D212: 14,15 | E212: TRANSISTOR MOSFET N-CHAN E-MODE TO 247AC | F212: 1855-0989 | G212: IRFP044 | H212: 28480 | J212: HP | P212: to-247
A213: Q1,4 | B213: 2 | C213: of:=2*[.B213] -> 4 | D213: 16,17 | E213: TRANSISTOR MOSFET N-CHAN E-MODE TO-3 SI | F213: 1855-0536 | G213: IRF440 | H213: 28480 | J213: HP
A214: Q2,3,10,11 | B214: 4 | C214: of:=4*[.B214] -> 16 | D214: ALL | E214: TRANSISTOR NPN 2N2222A SI TO-18 PD=500MW | F214: 1854-0477 | G214: 2N2222A | H214: 04713 | J214: Motorola | P214: to-18
A215: Q5,6,7,8 | B215: 4 | C215: of:=2*[.B215] -> 8 | D215: 14,15 | E215: TRANSISTOR NPN 2N2222A SI TO-18 PD=500MW | F215: 1854-0477 | G215: 2N2222A | H215: 04713 | J215: Motorola | P215: to-18
A216: Q6,7 | B216: 2 | C216: of:=2*[.B216] -> 4 | D216: 16,17 | E216: TRANSISTOR PNP 2N2907A SI TO-18 PD=400MW | F216: 1853-0281 | G216: 2N2907A | H216: 04713 | J216: Motorola | P216: to-18
A217: Q9 | B217: 1 | C217: of:=4*[.B217] -> 4 | D217: ALL | E217: TRANSISTOR PNP SI TO-39 PD=1W FT=60MHZ | F217: 1853-0041 | G217: MM5007 | H217: 04713 | J217: Motorola | P217: to-39
A219: CR1,19 | B219: 2 | C219: of:=4*[.B219] -> 8 | D219: ALL | E219: DIODE-PWR RECT 100V 6A 35NS | F219: 1901-1273 | G219: FE6B | H219: 14936 | J219: General Instruments | P219: axial, ball
A220: CR2 | B220: 1 | C220: of:=4*[.B220] -> 4 | D220: ALL | E220: DIODE-FW BRIDGE 100V 1A | F220: 1906-0284 | G220: DF01 | H220: 14936 | J220: General Instruments | P220: dip
A221: CR3,4,5,6,7 | B221: 5 | C221: of:=2*[.B221] -> 10 | D221: 14,15 | E221: DIODE-GEN PRP 180V 200MA DO-35 | F221: 1901-0033 | G221: 1N645 | H221: 27014 | J221: National Semi | P221: do-35
A222: CR8,9,16,17,31,32 | B222: 6 | C222: of:=4*[.B222] -> 24 | D222: ALL | E222: DIODE-PWR RECT 400V 1A 50NS DO-41 | F222: 1901-1149 | G222: UF4004 | H222: 14936 | J222: General Instruments | P222: do-41
A223: CR10,12,15,18,20 | B223: 5 | C223: of:=4*[.B223] -> 20 | D223: ALL | E223: THRYSTER-SCR TO-220AB VRRM=200V | F223: 1884-0332 | G223: MCR264-4 | H223: 04713 | J223: Motorola | P223: to-220
A224: CR11,14 | B224: 2 | C224: of:=2*[.B224] -> 4 | D224: 14,15 | E224: DIODE-PWR RECT 400V 1A 50NS DO-41 | F224: 1901-1149 | G224: UF4004 | H224: 14936 | J224: General Instruments | P224: do-41
A225: CR13 | B225: 1 | C225: of:=4*[.B225] -> 4 | D225: ALL | E225: DIODE-BRIDGE 600V 6A | F225: 1906-0400 | G225: GBU8J | H225: 14936 | J225: General Instruments | P225: gbu
A226: CR21,22,23,24,25,26,27,28,29,30 | B226: 10 | C226: of:=4*[.B226] -> 40 | D226: ALL | E226: DIODE-GEN PRP 180V 200MA DO-35 | F226: 1901-0033 | G226: 1N645 | H226: 27014 | J226: National Semi | P226: do-35
A228: VR1,2,3 | B228: 3 | C228: of:=4*[.B228] -> 12 | D228: ALL | E228: DIODE-ZNR 5.1V 5% PD=1W IR=10UA | F228: 1902-0579 | G228: 1N4733APL | H228: 04713 | J228: Motorola | P228: glass
A230: RT1,2 | B230: 2 | C230: of:=4*[.B230] -> 8 | D230: ALL | E230: DIODE-VARISTOR | F230: 0837-0261 | G230: V275LA20A | H230: 34371 | J230: Harris | P230: disc,red
A232: T1 | B232: 1 | C232: of:=1*[.B232] -> 1 | D232: 14 | E232: TRANSFORMER-POWER | F232: 9100-5068 | H232: 28480
A233: T1 | B233: 1 | C233: of:=1*[.B233] -> 1 | D233: 15 | E233: TRANSFORMER-POWER | F233: 9100-5069 | H233: 28480
A234: T1 | B234: 1 | C234: of:=1*[.B234] -> 1 | D234: 16 | E234: TRANSFORMER-POWER | F234: NO P/N | H234: 28480
A235: T1 | B235: 1 | C235: of:=1*[.B235] -> 1 | D235: 17 | E235: TRANSFORMER-POWER | F235: 9100-5070 | H235: 28480
A236: T2,3 | B236: 2 | C236: of:=2*[.B236] -> 4 | D236: 14,15 | E236: TRANSFORMER-PULSE PRI IND:5MH | F236: 9100-4969 | H236: 28480
A238: L1 | B238: 1 | C238: of:=4*[.B238] -> 4 | D238: ALL | E238: CORE-SHIELDING BEAD | F238: 9170-0894 | H238: 28480
A240: J1 | B240: 1 | C240: of:=4*[.B240] -> 4 | D240: ALL | E240: CONNECTOR-POST TYPE 2.5-PIN-SPCG 11-CO-NT | F240: 1252-4159 | H240: 28480
A242: TP1-16 | B242: 16 | C242: of:=4*[.B242] -> 64 | D242: ALL | E242: TERMINAL-TEST POINT .230IN ABOVE | F242: 0360-2359 | H242: 28480
A244: S1,2,3,4 | B244: 4 | C244: of:=4*[.B244] -> 16 | D244: ALL | E244: SWITCH-SL SPDT SUBMIN 6A 250VAC | F244: 3101-3237 | H244: 28480 | J244: Rear | K244: M(aster)/S(lave) 1,2 CV/CC L(ocal)/R(emote)
A245: S5 | B245: 1 | C245: of:=4*[.B245] -> 4 | D245: ALL | E245: SWITCH-SL DPDT SUBMIN 6A 250VAC | F245: 3101-3238 | H245: 28480 | J245: Rear | K245: Sense
A246: S6 | B246: 1 | C246: of:=4*[.B246] -> 4 | D246: ALL | E246: SWITCH-SL 2-DPDT STD 1.5A 250VAC PC | F246: 3101-1914 | H246: 28480 | J246: PCB | K246: 100/115/230VAC
A247: S7 | B247: 1 | C247: of:=4*[.B247] -> 4 | D247: ALL | E247: SWITCH-PB MOM .5A 250VAC | F247: 3101-3115 | H247: 28480 | J247: Front | K247: OVP/CC set
A248: S8 | B248: 1 | C248: of:=4*[.B248] -> 4 | D248: ALL | E248: SWITCH-PB DPSTALTNG 6A 250VAC | F248: 3101-3083 | H248: 28480 | J248: Front | K248: Power
B250: 3 | C250: of:=4*[.B250] -> 12 | D250: ALL | E250: TERMINAL BLOCK | F250: 0360-2548 | H250: 28480
B251: 1 | C251: of:=4*[.B251] -> 4 | D251: ALL | E251: TERMINAL BLOCK | F251: 0360-2545 | H251: 28480
B252: 9 | C252: of:=4*[.B252] -> 36 | D252: ALL | E252: TERMINAL BLOCK | F252: 0360-2546 | H252: 28480
B253: 1 | C253: of:=4*[.B253] -> 4 | D253: ALL | E253: TERMINAL BLOCK | F253: 0360-2547 | H253: 28480
B255: 1 | C255: of:=4*[.B255] -> 4 | D255: ALL | E255: KEY CAP - WHT | F255: 0371-3806 | H255: 28480
B256: 1 | C256: of:=4*[.B256] -> 4 | D256: ALL | E256: KEY CAP - GRAY | F256: 0371-8624 | H256: 28480
B258: 2 | C258: of:=4*[.B258] -> 8 | D258: ALL | E258: BINDING POST RED | F258: E3631-20011 | H258: 28480
B259: 2 | C259: of:=4*[.B259] -> 8 | D259: ALL | E259: BINDING POST BLACK | F259: E3631-20012 | H259: 28480
B260: 1 | C260: of:=4*[.B260] -> 4 | D260: ALL | E260: BINDING POST GREEN | F260: E3631-20013 | H260: 28480
B262: 3 | C262: of:=4*[.B262] -> 12 | D262: ALL | E262: NUT- BINDING POST | F262: 2950-0144 | H262: 28480
B263: 2 | C263: of:=4*[.B263] -> 8 | D263: ALL | E263: KNOB | F263: 5041-8621 | H263: 28480

Sheet: Sheet2
A1: of:=IF(ISBLANK([Sheet1.A1]);"";[Sheet1.A1]) -> Ref. Des. | B1: Mouser | I1: Deviations in Mouser order 2013-08-19 | M1: Corrections to Mouser order 2013-08-19
A2: of:=IF(ISBLANK([Sheet1.A2]);"";[Sheet1.A2]) ->  | B2: Manufacturer | C2: Mfr. P/N | D2: Mouser P/N | I2: Manufacturer | J2: Mfr. P/N | K2: Mouser P/N | M2: Manufacturer | N2: Mfr. P/N | O2: Mouser P/N
A3: of:=IF(ISBLANK([Sheet1.A3]);"";[Sheet1.A3]) -> 
A4: of:=IF(ISBLANK([Sheet1.A4]);"";[Sheet1.A4]) -> Capacitors | E4: Package | F4: DxH / LxWxH | G4: Lead Spacing
A5: of:=IF(ISBLANK([Sheet1.A5]);"";[Sheet1.A5]) -> C20,23 | B5: Nichicon | C5: UPW1H010MDD | D5: 647-UPW1H010MDD | E5: Can | F5: 5x11 | G5: 2
A6: of:=IF(ISBLANK([Sheet1.A6]);"";[Sheet1.A6]) -> C9,41,42,43,55 | B6: Nichicon | C6: UPW1H010MDD | D6: 647-UPW1H010MDD | E6: Can | F6: 5x11 | G6: 2
A7: of:=IF(ISBLANK([Sheet1.A7]);"";[Sheet1.A7]) -> C57 | B7: Nichicon | C7: UPW1H470MED | D7: 647-UPW1H470MED | E7: Can | F7: 6.3x11 | G7: 2.5
A8: of:=IF(ISBLANK([Sheet1.A8]);"";[Sheet1.A8]) -> C2 | B8: Nichicon | C8: UPW2A221MHD | D8: 647-UPW2A221MHD | E8: Can | F8: 16x25 | G8: 7.5
A9: of:=IF(ISBLANK([Sheet1.A9]);"";[Sheet1.A9]) -> C2 | B9: Nichicon | C9: UPW2A331MHD | D9: 647-UPW2A331MHD | E9: Can | F9: 16x25 | G9: 7.5
A10: of:=IF(ISBLANK([Sheet1.A10]);"";[Sheet1.A10]) -> C2 | B10: Nichicon | C10: UPW1J471MHD3 | D10: 647-UPW1J471MHD3 | E10: Can | F10: 16x20 | G10: 7.5
A11: of:=IF(ISBLANK([Sheet1.A11]);"";[Sheet1.A11]) -> C2 | B11: Nichicon | C11: UPW1H102MHD | D11: 647-UPW1H102MHD | E11: Can | F11: 16x25 | G11: 7.5
A12: of:=IF(ISBLANK([Sheet1.A12]);"";[Sheet1.A12]) -> C52 | B12: Nichicon | C12: UPW1V331MPD | D12: 647-UPW1V331MPD | E12: Can | F12: 10x16 | G12: 5
A13: of:=IF(ISBLANK([Sheet1.A13]);"";[Sheet1.A13]) -> C53 | B13: Nichicon | C13: UPW1H471MHD | D13: 647-UPW1H471MHD | E13: Can | F13: 12.5x20 | G13: 5
A14: of:=IF(ISBLANK([Sheet1.A14]);"";[Sheet1.A14]) -> C6 | B14: Nichicon | C14: UPW1E472MHD | D14: 647-UPW1E472MHD | E14: Can | F14: 18x35.5 | G14: 7.5 | I14: Nichicon | J14: UVK1E472MHD | K14: 647-UVK1E472MHD
A15: of:=IF(ISBLANK([Sheet1.A15]);"";[Sheet1.A15]) -> 
A16: of:=IF(ISBLANK([Sheet1.A16]);"";[Sheet1.A16]) -> C7,8 | B16: United Chemi-Con | C16: EKMQ161VSN272MA40S | D16: 661-EKMQ161N272MA40S | E16: Can | F16: 35x40 | G16: 10 | I16: United Chemi-Con | J16: ESMH250VSN393MA50T | K16: 661-ESMH250N393MA50T
A17: of:=IF(ISBLANK([Sheet1.A17]);"";[Sheet1.A17]) -> C7,8 | B17: United Chemi-Con | C17: ESMH101VSN562MA45T | D17: 661-ESMH101N562MA45T | E17: Can | F17: 35x45 | G17: 10
A18: of:=IF(ISBLANK([Sheet1.A18]);"";[Sheet1.A18]) -> C7,8 | B18: United Chemi-Con | C18: ESMH630VSN123MA45T | D18: 661-ESMH630N123MA45T | E18: Can | F18: 35x45 | G18: 10 | I18: United Chemi-Con | J18: ESMH630VNN123MA45T | K18: 661-ESMH630VNN123MA
A19: of:=IF(ISBLANK([Sheet1.A19]);"";[Sheet1.A19]) -> C7,8 | B19: United Chemi-Con | C19: ESMH250VSN393MA50T | D19: 661-ESMH250N393MA50T | E19: Can | F19: 35x50 | G19: 10
A20: of:=IF(ISBLANK([Sheet1.A20]);"";[Sheet1.A20]) -> 
A21: of:=IF(ISBLANK([Sheet1.A21]);"";[Sheet1.A21]) -> C37 | B21: TDK | C21: FK18C0G2A101J | D21: 810-FK18C0G2A101J | E21: Radial | F21: 4x2.5x5.5 | G21: 2.5 | M21: Kemet | N21: C410C101J1G5TA | O21: 80-C410C101J1G
A22: of:=IF(ISBLANK([Sheet1.A22]);"";[Sheet1.A22]) -> C62 | B22: TDK | C22: FK18C0G2A471J | D22: 810-FK18C0G2A471J | E22: Radial | F22: 4x2.5x5.5 | G22: 2.5 | M22: Kemet | N22: C410C471J1G5TA | O22: 80-C410C471J1G
A23: of:=IF(ISBLANK([Sheet1.A23]);"";[Sheet1.A23]) -> C19,22 | B23: TDK | C23: FK14C0G2A102J | D23: 810-FK14C0G2A102J | E23: Radial | F23: 5.5x4.5x5.5 | G23: 2.5 | M23: Kemet | N23: C410C102J1G5TA | O23: 80-C410C102J1G
A24: of:=IF(ISBLANK([Sheet1.A24]);"";[Sheet1.A24]) -> C33,35,44,45,46,56 | B24: TDK | C24: FK14C0G2A102J | D24: 810-FK14C0G2A102J | E24: Radial | F24: 5.5x4.5x5.5 | G24: 2.5 | M24: Kemet | N24: C410C102J1G5TA | O24: 80-C410C102J1G
A26: of:=IF(ISBLANK([Sheet1.A26]);"";[Sheet1.A26]) -> C11,16,17,25,26 | B26: TDK | C26: FK18X7R2A103K | D26: 810-FK18X7R2A103K | E26: Radial | F26: 4x2.5x5.5 | G26: 2.5 | M26: Kemet | N26: C410C103K1R5TA | O26: 80-C410C103K1R
A27: of:=IF(ISBLANK([Sheet1.A27]);"";[Sheet1.A27]) -> C13,14,15,30,32,34,38,39,50,54 | B27: TDK | C27: FK18X7R2A103K | D27: 810-FK18X7R2A103K | E27: Radial | F27: 4x2.5x5.5 | G27: 2.5 | M27: Kemet | N27: C410C103K1R5TA | O27: 80-C410C103K1R
A28: of:=IF(ISBLANK([Sheet1.A28]);"";[Sheet1.A28]) -> C29 | B28: TDK | C28: FK18X7R2A103K | D28: 810-FK18X7R2A103K | E28: Radial | F28: 4x2.5x5.5 | G28: 2.5 | M28: Kemet | N28: C410C103K1R5TA | O28: 80-C410C103K1R
A29: of:=IF(ISBLANK([Sheet1.A29]);"";[Sheet1.A29]) -> C1,3,47 | B29: TDK | C29: FK18X7R1H104K | D29: 810-FK18X7R1H104K | E29: Radial | F29: 4x2.5x5.5 | G29: 2.5 | M29: Kemet | N29: C412C104K5R5TA | O29: 80-C412C104K5R
A30: of:=IF(ISBLANK([Sheet1.A30]);"";[Sheet1.A30]) -> C12 | B30: TDK | C30: FK18X7R1H104K | D30: 810-FK18X7R1H104K | E30: Radial | F30: 4x2.5x5.5 | G30: 2.5 | M30: Kemet | N30: C412C104K5R5TA | O30: 80-C412C104K5R
A32: of:=IF(ISBLANK([Sheet1.A32]);"";[Sheet1.A32]) -> C36 | B32: TDK | C32: FK24C0G2A222J | D32: 810-FK24C0G2A222J | E32: Radial | F32: 4x2.5x5.5 | G32: 2.5 | M32: Kemet | N32: C322C222K5R5TA | O32: 80-C322C222K5R
A33: of:=IF(ISBLANK([Sheet1.A33]);"";[Sheet1.A33]) -> C4,5 | B33: TDK | C33: FK22X7R2J104K | D33: 810-FK22X7R2J104K | E33: Radial | F33: 7.5x4x8 | G33: 5 | M33: Vishay / BC Components | N33: S104Z93Z5VL83L0R | O33: 594-S104Z93Z5VL83L0R
A34: of:=IF(ISBLANK([Sheet1.A34]);"";[Sheet1.A34]) -> C67 | B34: TDK | C34: FK18X7R1H224K | D34: 810-FK18X7R1H224K | E34: Radial | F34: 4x2.5x5.5 | G34: 2.5 | I34: TDK | J34: FK14X7R1H224K | K34: 810-FK14X7R1H224K | M34: Kemet | N34: C322C224K5R5TA | O34: 80-C322C224K5R
A35: of:=IF(ISBLANK([Sheet1.A35]);"";[Sheet1.A35]) -> 
A36: of:=IF(ISBLANK([Sheet1.A36]);"";[Sheet1.A36]) -> C63,64,65,66 | B36: Panasonic | C36: ECQ-E2123JF | D36: 667-ECQ-E2123JF | E36: Radial | F36: 10.3x4.4x7.5 | G36: 7.5
A37: of:=IF(ISBLANK([Sheet1.A37]);"";[Sheet1.A37]) -> C18,21,24,27 | B37: Panasonic | C37: ECQ-E6104KF | D37: 667-ECQ-E6104KF | E37: Radial | F37: 18.5x6.3x15 | G37: 15
A38: of:=IF(ISBLANK([Sheet1.A38]);"";[Sheet1.A38]) -> C10,48,49 | B38: Panasonic | C38: ECQ-E2334JF | D38: 667-ECQ-E2334JF | E38: Radial | F38: 12x6.5x13 | G38: 10 | M38: Nichicon | N38: QYX1H334KTP | O38: 647-QYX1H334KTP
A39: of:=IF(ISBLANK([Sheet1.A39]);"";[Sheet1.A39]) -> C28 | B39: Panasonic | C39: ECQ-E2334JF | D39: 667-ECQ-E2334JF | E39: Radial | F39: 12x6.5x13 | G39: 10
A40: of:=IF(ISBLANK([Sheet1.A40]);"";[Sheet1.A40]) -> 
A41: of:=IF(ISBLANK([Sheet1.A41]);"";[Sheet1.A41]) -> C31 | B41: Panasonic | C41: ECW-HA3C472H | D41: 667-ECW-HA3C472H | E41: Radial | F41: 17.8x6.4x9.1 | G41: 15 | I41: Kemet | J41: PFR5472J63J11L4BULK | K41: 80-PFR5472J63J11L4 | M41: Kemet | N41: PHE426DJ4470JR05 | O41: 80-PHE426DJ4470JR05
A42: of:=IF(ISBLANK([Sheet1.A42]);"";[Sheet1.A42]) -> C29 | B42: Panasonic | C42: ECW-H8473HA | D42: 667-ECW-H8473HA | E42: Radial | F42: 15.7x9.7x15.6 | G42: 12.5 | M42: Nichicon | N42: QYX2A473KTP | O42: 647-QYX2A473KTP
A43: of:=IF(ISBLANK([Sheet1.A43]);"";[Sheet1.A43]) -> C40 | B43: Panasonic | C43: ECW-H8473HA | D43: 667-ECW-H8473HA | E43: Radial | F43: 15.7x9.7x15.6 | G43: 12.5 | M43: Nichicon
A44: of:=IF(ISBLANK([Sheet1.A44]);"";[Sheet1.A44]) -> C61 | B44: Panasonic | C44: ECW-FD2W105J | D44: 667-ECW-FD2W105J | E44: Radial | F44: 17.5x7.8x11 | G44: 7.5
A46: of:=IF(ISBLANK([Sheet1.A46]);"";[Sheet1.A46]) -> C59,60 | B46: Vishay | C46: VY1472M63Y5UQ63V0 | D46: 72-VY1472M63Y5UQ63V0 | E46: Disc | F46: 16x20 | G46: 10
A47: of:=IF(ISBLANK([Sheet1.A47]);"";[Sheet1.A47]) -> C58 | B47: Panasonic | C47: ECQ-UAAF104M | D47: 667-ECQ-UAAF104M | E47: Radial | F47: 17.5x5x12.5 | G47: 15
A48: of:=IF(ISBLANK([Sheet1.A48]);"";[Sheet1.A48]) -> 
A49: of:=IF(ISBLANK([Sheet1.A49]);"";[Sheet1.A49]) -> 
A50: of:=IF(ISBLANK([Sheet1.A50]);"";[Sheet1.A50]) -> Resistors | E50: Package | F50: DxL
A51: of:=IF(ISBLANK([Sheet1.A51]);"";[Sheet1.A51]) -> R42,44,54,56 | B51: KOA Speer | C51: MF1/4DC10R0F | D51: 660-MF1/4DC10R0F | E51: Axial | F51: 2.3x7.1
A52: of:=IF(ISBLANK([Sheet1.A52]);"";[Sheet1.A52]) -> R90 | B52: KOA Speer | C52: MF1/4DC10R0F | D52: 660-MF1/4DC10R0F | E52: Axial | F52: 2.3x7.1
A53: of:=IF(ISBLANK([Sheet1.A53]);"";[Sheet1.A53]) -> R77 | B53: KOA Speer | C53: MF1/4DC21R5F | D53: 660-MF1/4DC21R5F | E53: Axial | F53: 2.3x7.1
A54: of:=IF(ISBLANK([Sheet1.A54]);"";[Sheet1.A54]) -> R77 | B54: KOA Speer | C54: MF1/4DC56R2F | D54: 660-MF1/4DC56R2F | E54: Axial | F54: 2.3x7.1
A55: of:=IF(ISBLANK([Sheet1.A55]);"";[Sheet1.A55]) -> R5,6,80 | B55: KOA Speer | C55: MF1/4DC1000F | D55: 660-MF1/4DC1000F | E55: Axial | F55: 2.3x7.1
A56: of:=IF(ISBLANK([Sheet1.A56]);"";[Sheet1.A56]) -> R43,45,55,57 | B56: KOA Speer | C56: MF1/4DC1000F | D56: 660-MF1/4DC1000F | E56: Axial | F56: 2.3x7.1
A57: of:=IF(ISBLANK([Sheet1.A57]);"";[Sheet1.A57]) -> R126 | B57: KOA Speer | C57: MF1/4DC1000F | D57: 660-MF1/4DC1000F | E57: Axial | F57: 2.3x7.1
A58: of:=IF(ISBLANK([Sheet1.A58]);"";[Sheet1.A58]) -> R42,44,54,56 | B58: KOA Speer | C58: MF1/4DC1470F | D58: 660-MF1/4DC1470F | E58: Axial | F58: 2.3x7.1
A59: of:=IF(ISBLANK([Sheet1.A59]);"";[Sheet1.A59]) -> R102 | B59: KOA Speer | C59: MF1/4DC1470F | D59: 660-MF1/4DC1470F | E59: Axial | F59: 2.3x7.1
A60: of:=IF(ISBLANK([Sheet1.A60]);"";[Sheet1.A60]) -> R118 | B60: KOA Speer | C60: MF1/4DC1780F | D60: 660-MF1/4DC1780F | E60: Axial | F60: 2.3x7.1 | I60: KOA Speer | J60: MF1/4DCT52R1780F | K60: 660-MF1/4DCT52R1780F
A61: of:=IF(ISBLANK([Sheet1.A61]);"";[Sheet1.A61]) -> R101 | B61: KOA Speer | C61: MF1/4DC2150F | D61: 660-MF1/4DC2150F | E61: Axial | F61: 2.3x7.1
A62: of:=IF(ISBLANK([Sheet1.A62]);"";[Sheet1.A62]) -> R87 | B62: KOA Speer | C62: MF1/4DC3160F | D62: 660-MF1/4DC3160F | E62: Axial | F62: 2.3x7.1
A63: of:=IF(ISBLANK([Sheet1.A63]);"";[Sheet1.A63]) -> R47,50 | B63: KOA Speer | C63: MF1/4DC4990F | D63: 660-MF1/4DC4990F | E63: Axial | F63: 2.3x7.1
A64: of:=IF(ISBLANK([Sheet1.A64]);"";[Sheet1.A64]) -> R100 | B64: KOA Speer | C64: MF1/4DC4990F | D64: 660-MF1/4DC4990F | E64: Axial | F64: 2.3x7.1
A65: of:=IF(ISBLANK([Sheet1.A65]);"";[Sheet1.A65]) -> R8,9,12 | B65: KOA Speer | C65: MF1/4DC1001F | D65: 660-MF1/4DC1001F | E65: Axial | F65: 2.3x7.1
A66: of:=IF(ISBLANK([Sheet1.A66]);"";[Sheet1.A66]) -> R17,18,66,78,110,123 | B66: KOA Speer | C66: MF1/4DC1001F | D66: 660-MF1/4DC1001F | E66: Axial | F66: 2.3x7.1
A67: of:=IF(ISBLANK([Sheet1.A67]);"";[Sheet1.A67]) -> R65 | B67: KOA Speer | C67: MF1/4DC1211F | D67: 660-MF1/4DC1211F | E67: Axial | F67: 2.3x7.1
A68: of:=IF(ISBLANK([Sheet1.A68]);"";[Sheet1.A68]) -> R103 | B68: KOA Speer | C68: MF1/4DC1621F | D68: 660-MF1/4DC1621F | E68: Axial | F68: 2.3x7.1
A69: of:=IF(ISBLANK([Sheet1.A69]);"";[Sheet1.A69]) -> R19,113 | B69: KOA Speer | C69: MF1/4DC1961F | D69: 660-MF1/4DC1961F | E69: Axial | F69: 2.3x7.1
A70: of:=IF(ISBLANK([Sheet1.A70]);"";[Sheet1.A70]) -> R43,55 | B70: KOA Speer | C70: MF1/4DC1961F | D70: 660-MF1/4DC1961F | E70: Axial | F70: 2.3x7.1
A71: of:=IF(ISBLANK([Sheet1.A71]);"";[Sheet1.A71]) -> R49,51 | B71: KOA Speer | C71: MF1/4DC1961F | D71: 660-MF1/4DC1961F | E71: Axial | F71: 2.3x7.1
A72: of:=IF(ISBLANK([Sheet1.A72]);"";[Sheet1.A72]) -> R31,32,35 | B72: KOA Speer | C72: MF1/4DC2151F | D72: 660-MF1/4DC2151F | E72: Axial | F72: 2.3x7.1
A73: of:=IF(ISBLANK([Sheet1.A73]);"";[Sheet1.A73]) -> R40 | B73: KOA Speer | C73: MF1/4DC2431F | D73: 660-MF1/4DC2431F | E73: Axial | F73: 2.3x7.1
A74: of:=IF(ISBLANK([Sheet1.A74]);"";[Sheet1.A74]) -> R61 | B74: KOA Speer | C74: MF1/4DC2611F | D74: 660-MF1/4DC2611F | E74: Axial | F74: 2.3x7.1
A75: of:=IF(ISBLANK([Sheet1.A75]);"";[Sheet1.A75]) -> R40 | B75: KOA Speer | C75: MF1/4DC3091F | D75: 660-MF1/4DC3091F | E75: Axial | F75: 2.3x7.1
A76: of:=IF(ISBLANK([Sheet1.A76]);"";[Sheet1.A76]) -> R109 | B76: KOA Speer | C76: MF1/4DC3831F | D76: 660-MF1/4DC3831F | E76: Axial | F76: 2.3x7.1 | I76: KOA Speer | J76: MF1/4DCT52R3831F | K76: 660-MF1/4DCT52R3831F
A77: of:=IF(ISBLANK([Sheet1.A77]);"";[Sheet1.A77]) -> R67 | B77: KOA Speer | C77: MF1/4DC5111F | D77: 660-MF1/4DC5111F | E77: Axial | F77: 2.3x7.1
A78: of:=IF(ISBLANK([Sheet1.A78]);"";[Sheet1.A78]) -> R40 | B78: KOA Speer | C78: MF1/4DC5231F | D78: 660-MF1/4DC5231F | E78: Axial | F78: 2.3x7.1
A79: of:=IF(ISBLANK([Sheet1.A79]);"";[Sheet1.A79]) -> R72 | B79: KOA Speer | C79: MF1/4DC6191F | D79: 660-MF1/4DC6191F | E79: Axial | F79: 2.3x7.1
A80: of:=IF(ISBLANK([Sheet1.A80]);"";[Sheet1.A80]) -> R36 | B80: KOA Speer | C80: MF1/4DC6811F | D80: 660-MF1/4DC6811F | E80: Axial | F80: 2.3x7.1
A81: of:=IF(ISBLANK([Sheet1.A81]);"";[Sheet1.A81]) -> R40 | B81: KOA Speer | C81: MF1/4DC6811F | D81: 660-MF1/4DC6811F | E81: Axial | F81: 2.3x7.1
A82: of:=IF(ISBLANK([Sheet1.A82]);"";[Sheet1.A82]) -> R39 | B82: KOA Speer | C82: MF1/4DC7151F | D82: 660-MF1/4DC7151F | E82: Axial | F82: 2.3x7.1
A83: of:=IF(ISBLANK([Sheet1.A83]);"";[Sheet1.A83]) -> R36 | B83: KOA Speer | C83: MF1/4DC7321F | D83: 660-MF1/4DC7321F | E83: Axial | F83: 2.3x7.1
A84: of:=IF(ISBLANK([Sheet1.A84]);"";[Sheet1.A84]) -> R39 | B84: KOA Speer | C84: MF1/4DC7501F | D84: 660-MF1/4DC7501F | E84: Axial | F84: 2.3x7.1
A85: of:=IF(ISBLANK([Sheet1.A85]);"";[Sheet1.A85]) -> R83,119 | B85: KOA Speer | C85: MF1/4DC7501F | D85: 660-MF1/4DC7501F | E85: Axial | F85: 2.3x7.1
A86: of:=IF(ISBLANK([Sheet1.A86]);"";[Sheet1.A86]) -> R41 | B86: KOA Speer | C86: MF1/4DC8061F | D86: 660-MF1/4DC8061F | E86: Axial | F86: 2.3x7.1
A87: of:=IF(ISBLANK([Sheet1.A87]);"";[Sheet1.A87]) -> R36 | B87: KOA Speer | C87: MF1/4DC8251F | D87: 660-MF1/4DC8251F | E87: Axial | F87: 2.3x7.1
A88: of:=IF(ISBLANK([Sheet1.A88]);"";[Sheet1.A88]) -> R39 | B88: KOA Speer | C88: MF1/4DC8661F | D88: 660-MF1/4DC8661F | E88: Axial | F88: 2.3x7.1
A89: of:=IF(ISBLANK([Sheet1.A89]);"";[Sheet1.A89]) -> R34 | B89: KOA Speer | C89: MF1/4DC9091F | D89: 660-MF1/4DC9091F | E89: Axial | F89: 2.3x7.1
A90: of:=IF(ISBLANK([Sheet1.A90]);"";[Sheet1.A90]) -> R36 | B90: KOA Speer | C90: MF1/4DC9531F | D90: 660-MF1/4DC9531F | E90: Axial | F90: 2.3x7.1
A91: of:=IF(ISBLANK([Sheet1.A91]);"";[Sheet1.A91]) -> R15 | B91: KOA Speer | C91: MF1/4DC1002F | D91: 660-MF1/4DC1002F | E91: Axial | F91: 2.3x7.1
A92: of:=IF(ISBLANK([Sheet1.A92]);"";[Sheet1.A92]) -> R24,26,27,37,38,64,88,117,120 | B92: KOA Speer | C92: MF1/4DC1002F | D92: 660-MF1/4DC1002F | E92: Axial | F92: 2.3x7.1
A93: of:=IF(ISBLANK([Sheet1.A93]);"";[Sheet1.A93]) -> R39 | B93: KOA Speer | C93: MF1/4DC1002F | D93: 660-MF1/4DC1002F | E93: Axial | F93: 2.3x7.1
A94: of:=IF(ISBLANK([Sheet1.A94]);"";[Sheet1.A94]) -> R74,75 | B94: KOA Speer | C94: MF1/4DC1212F | D94: 660-MF1/4DC1212F | E94: Axial | F94: 2.3x7.1
A95: of:=IF(ISBLANK([Sheet1.A95]);"";[Sheet1.A95]) -> R72 | B95: KOA Speer | C95: MF1/4DC1332F | D95: 660-MF1/4DC1332F | E95: Axial | F95: 2.3x7.1
A96: of:=IF(ISBLANK([Sheet1.A96]);"";[Sheet1.A96]) -> R93 | B96: KOA Speer | C96: MF1/4DC1372F | D96: 660-MF1/4DC1372F | E96: Axial | F96: 2.3x7.1
A97: of:=IF(ISBLANK([Sheet1.A97]);"";[Sheet1.A97]) -> R104,107 | B97: KOA Speer | C97: MF1/4DC1472F | D97: 660-MF1/4DC1472F | E97: Axial | F97: 2.3x7.1
A98: of:=IF(ISBLANK([Sheet1.A98]);"";[Sheet1.A98]) -> R74,75 | B98: KOA Speer | C98: MF1/4DC1782F | D98: 660-MF1/4DC1782F | E98: Axial | F98: 2.3x7.1
A99: of:=IF(ISBLANK([Sheet1.A99]);"";[Sheet1.A99]) -> R14,48,52 | B99: KOA Speer | C99: MF1/4DC1962F | D99: 660-MF1/4DC1962F | E99: Axial | F99: 2.3x7.1
A100: of:=IF(ISBLANK([Sheet1.A100]);"";[Sheet1.A100]) -> R81,122 | B100: KOA Speer | C100: MF1/4DC1962F | D100: 660-MF1/4DC1962F | E100: Axial | F100: 2.3x7.1
A101: of:=IF(ISBLANK([Sheet1.A101]);"";[Sheet1.A101]) -> R74,75 | B101: KOA Speer | C101: MF1/4DC2052F | D101: 660-MF1/4DC2052F | E101: Axial | F101: 2.3x7.1
A102: of:=IF(ISBLANK([Sheet1.A102]);"";[Sheet1.A102]) -> R70 | B102: KOA Speer | C102: MF1/4DC2372F | D102: 660-MF1/4DC2372F | E102: Axial | F102: 2.3x7.1
A103: of:=IF(ISBLANK([Sheet1.A103]);"";[Sheet1.A103]) -> R72 | B103: KOA Speer | C103: MF1/4DC2612F | D103: 660-MF1/4DC2612F | E103: Axial | F103: 2.3x7.1
A104: of:=IF(ISBLANK([Sheet1.A104]);"";[Sheet1.A104]) -> R82 | B104: KOA Speer | C104: MF1/4DC2612F | D104: 660-MF1/4DC2612F | E104: Axial | F104: 2.3x7.1
A105: of:=IF(ISBLANK([Sheet1.A105]);"";[Sheet1.A105]) -> R116 | B105: KOA Speer | C105: MF1/4DC2802F | D105: 660-MF1/4DC2802F | E105: Axial | F105: 2.3x7.1
A106: of:=IF(ISBLANK([Sheet1.A106]);"";[Sheet1.A106]) -> R3,7,21,22,105,106 | B106: KOA Speer | C106: MF1/4DC3162F | D106: 660-MF1/4DC3162F | E106: Axial | F106: 2.3x7.1
A107: of:=IF(ISBLANK([Sheet1.A107]);"";[Sheet1.A107]) -> R98 | B107: KOA Speer | C107: MF1/4DC3162F | D107: 660-MF1/4DC3162F | E107: Axial | F107: 2.3x7.1
A108: of:=IF(ISBLANK([Sheet1.A108]);"";[Sheet1.A108]) -> R41 | B108: KOA Speer | C108: MF1/4DC3322F | D108: 660-MF1/4DC3322F | E108: Axial | F108: 2.3x7.1
A109: of:=IF(ISBLANK([Sheet1.A109]);"";[Sheet1.A109]) -> R116 | B109: KOA Speer | C109: MF1/4DC3572F | D109: 660-MF1/4DC3572F | E109: Axial | F109: 2.3x7.1
A110: of:=IF(ISBLANK([Sheet1.A110]);"";[Sheet1.A110]) -> R116 | B110: KOA Speer | C110: MF1/4DC3832F | D110: 660-MF1/4DC3832F | E110: Axial | F110: 2.3x7.1
A111: of:=IF(ISBLANK([Sheet1.A111]);"";[Sheet1.A111]) -> R62 | B111: KOA Speer | C111: MF1/4DC4222F | D111: 660-MF1/4DC4222F | E111: Axial | F111: 2.3x7.1
A112: of:=IF(ISBLANK([Sheet1.A112]);"";[Sheet1.A112]) -> R29,68,86,89,91,92,95,96,99,114,121 | B112: KOA Speer | C112: MF1/4DC4642F | D112: 660-MF1/4DC4642F | E112: Axial | F112: 2.3x7.1
A113: of:=IF(ISBLANK([Sheet1.A113]);"";[Sheet1.A113]) -> R28,111 | B113: KOA Speer | C113: MF1/4DC4992F | D113: 660-MF1/4DC4992F | E113: Axial | F113: 2.3x7.1
A114: of:=IF(ISBLANK([Sheet1.A114]);"";[Sheet1.A114]) -> R72 | B114: KOA Speer | C114: MF1/4DC5112F | D114: 660-MF1/4DC5112F | E114: Axial | F114: 2.3x7.1
A115: of:=IF(ISBLANK([Sheet1.A115]);"";[Sheet1.A115]) -> R41 | B115: KOA Speer | C115: MF1/4DC6652F | D115: 660-MF1/4DC6652F | E115: Axial | F115: 2.3x7.1
A116: of:=IF(ISBLANK([Sheet1.A116]);"";[Sheet1.A116]) -> R13 | B116: KOA Speer | C116: MF1/4DC6812F | D116: 660-MF1/4DC6812F | E116: Axial | F116: 2.3x7.1
A117: of:=IF(ISBLANK([Sheet1.A117]);"";[Sheet1.A117]) -> R82 | B117: KOA Speer | C117: MF1/4DC6812F | D117: 660-MF1/4DC6812F | E117: Axial | F117: 2.3x7.1
A118: of:=IF(ISBLANK([Sheet1.A118]);"";[Sheet1.A118]) -> R98 | B118: KOA Speer | C118: MF1/4DC6812F | D118: 660-MF1/4DC6812F | E118: Axial | F118: 2.3x7.1
A119: of:=IF(ISBLANK([Sheet1.A119]);"";[Sheet1.A119]) -> R115 | B119: KOA Speer | C119: MF1/4DC7502F | D119: 660-MF1/4DC7502F | E119: Axial | F119: 2.3x7.1
A120: of:=IF(ISBLANK([Sheet1.A120]);"";[Sheet1.A120]) -> R115 | B120: KOA Speer | C120: MF1/4DC7502F | D120: 660-MF1/4DC7502F | E120: Axial | F120: 2.3x7.1
A121: of:=IF(ISBLANK([Sheet1.A121]);"";[Sheet1.A121]) -> R115 | B121: KOA Speer | C121: MF1/4DC8252F | D121: 660-MF1/4DC8252F | E121: Axial | F121: 2.3x7.1
A122: of:=IF(ISBLANK([Sheet1.A122]);"";[Sheet1.A122]) -> R20,23 | B122: KOA Speer | C122: MF1/4DC8252F | D122: 660-MF1/4DC8252F | E122: Axial | F122: 2.3x7.1
A123: of:=IF(ISBLANK([Sheet1.A123]);"";[Sheet1.A123]) -> R115 | B123: KOA Speer | C123: MF1/4DC8252F | D123: 660-MF1/4DC8252F | E123: Axial | F123: 2.3x7.1
A124: of:=IF(ISBLANK([Sheet1.A124]);"";[Sheet1.A124]) -> R4,71,73,76,112 | B124: KOA Speer | C124: MF1/4DC1003F | D124: 660-MF1/4DC1003F | E124: Axial | F124: 2.3x7.1
A125: of:=IF(ISBLANK([Sheet1.A125]);"";[Sheet1.A125]) -> R16 | B125: KOA Speer | C125: MF1/4DC1003F | D125: 660-MF1/4DC1003F | E125: Axial | F125: 2.3x7.1
A126: of:=IF(ISBLANK([Sheet1.A126]);"";[Sheet1.A126]) -> R70 | B126: KOA Speer | C126: MF1/4DC1003F | D126: 660-MF1/4DC1003F | E126: Axial | F126: 2.3x7.1
A127: of:=IF(ISBLANK([Sheet1.A127]);"";[Sheet1.A127]) -> R98 | B127: KOA Speer | C127: MF1/4DC1003F | D127: 660-MF1/4DC1003F | E127: Axial | F127: 2.3x7.1
A128: of:=IF(ISBLANK([Sheet1.A128]);"";[Sheet1.A128]) -> R62 | B128: KOA Speer | C128: MF1/4DC1053F | D128: 660-MF1/4DC1053F | E128: Axial | F128: 2.3x7.1
A129: of:=IF(ISBLANK([Sheet1.A129]);"";[Sheet1.A129]) -> R41 | B129: KOA Speer | C129: MF1/4DC1213F | D129: 660-MF1/4DC1213F | E129: Axial | F129: 2.3x7.1
A130: of:=IF(ISBLANK([Sheet1.A130]);"";[Sheet1.A130]) -> R79 | B130: KOA Speer | C130: MF1/4DC1473F | D130: 660-MF1/4DC1473F | E130: Axial | F130: 2.3x7.1
A131: of:=IF(ISBLANK([Sheet1.A131]);"";[Sheet1.A131]) -> R70 | B131: KOA Speer | C131: MF1/4DC1783F | D131: 660-MF1/4DC1783F | E131: Axial | F131: 2.3x7.1
A132: of:=IF(ISBLANK([Sheet1.A132]);"";[Sheet1.A132]) -> R98 | B132: KOA Speer | C132: MF1/4DC2613F | D132: 660-MF1/4DC2613F | E132: Axial | F132: 2.3x7.1
A133: of:=IF(ISBLANK([Sheet1.A133]);"";[Sheet1.A133]) -> R70 | B133: KOA Speer | C133: MF1/4DC3833F | D133: 660-MF1/4DC3833F | E133: Axial | F133: 2.3x7.1 | I133: KOA Speer | J133: MF1/4DCT52R3833F | K133: 660-MF1/4D52R3833F
A134: of:=IF(ISBLANK([Sheet1.A134]);"";[Sheet1.A134]) -> R79 | B134: KOA Speer | C134: MF1/4DC4223F | D134: 660-MF1/4DC4223F | E134: Axial | F134: 2.3x7.1 | I134: KOA Speer | J134: MF1/4DCT52R4223F | K134: 660-MF1/4DCT52R4223F
A135: of:=IF(ISBLANK([Sheet1.A135]);"";[Sheet1.A135]) -> R62 | B135: KOA Speer | C135: MF1/4DC4753F | D135: 660-MF1/4DC4753F | E135: Axial | F135: 2.3x7.1
A136: of:=IF(ISBLANK([Sheet1.A136]);"";[Sheet1.A136]) -> R25,30,33 | B136: KOA Speer | C136: MF1/4DC5623F | D136: 660-MF1/4DC5623F | E136: Axial | F136: 2.3x7.1
A137: of:=IF(ISBLANK([Sheet1.A137]);"";[Sheet1.A137]) -> R79 | B137: KOA Speer | C137: MF1/4DC6813F | D137: 660-MF1/4DC6813F | E137: Axial | F137: 2.3x7.1
A138: of:=IF(ISBLANK([Sheet1.A138]);"";[Sheet1.A138]) -> R125 | B138: KOA Speer | C138: MF1/4DC6813F | D138: 660-MF1/4DC6813F | E138: Axial | F138: 2.3x7.1
A139: of:=IF(ISBLANK([Sheet1.A139]);"";[Sheet1.A139]) -> R62 | B139: KOA Speer | C139: MF1/4DC8253F | D139: 660-MF1/4DC8253F | E139: Axial | F139: 2.3x7.1
A140: of:=IF(ISBLANK([Sheet1.A140]);"";[Sheet1.A140]) -> R63 | B140: KOA Speer | C140: MF1/4DC1004F | D140: 660-MF1/4DC1004F | E140: Axial | F140: 2.3x7.1
A141: of:=IF(ISBLANK([Sheet1.A141]);"";[Sheet1.A141]) -> R79 | B141: KOA Speer | C141: MF1/4DC1004F | D141: 660-MF1/4DC1004F | E141: Axial | F141: 2.3x7.1
A142: of:=IF(ISBLANK([Sheet1.A142]);"";[Sheet1.A142]) -> 
A143: of:=IF(ISBLANK([Sheet1.A143]);"";[Sheet1.A143]) -> R124 | B143: KOA Speer | C143: MF1/4DC1R00F | D143: 660-MF1/4DC1R00F | E143: Axial | F143: 2.3x7.1
A144: of:=IF(ISBLANK([Sheet1.A144]);"";[Sheet1.A144]) -> R46,53 | B144: KOA Speer | C144: MF1/4DC10R0F | D144: 660-MF1/4DC10R0F | E144: Axial | F144: 2.3x7.1
A145: of:=IF(ISBLANK([Sheet1.A145]);"";[Sheet1.A145]) -> R8,9 | B145: KOA Speer | C145: MF1DCT521R1001F | D145: 660-MF1DCT521R1001F | E145: Axial | F145: 5.5x15.5
A146: of:=IF(ISBLANK([Sheet1.A146]);"";[Sheet1.A146]) -> 
A147: of:=IF(ISBLANK([Sheet1.A147]);"";[Sheet1.A147]) -> R11 | B147: Vishay | C147: AC03000002001JAC00 | D147: 594-AC03W2K000J | E147: Axial | F147: 4.8x13
A148: of:=IF(ISBLANK([Sheet1.A148]);"";[Sheet1.A148]) -> R11 | B148: Vishay | C148: AC03000005001JAC00 | D148: 594-AC03W5K000J | E148: Axial | F148: 4.8x13
A149: of:=IF(ISBLANK([Sheet1.A149]);"";[Sheet1.A149]) -> R11 | B149: TT Electronics | C149: CMO22702JLFTR | D149: 66-CMO22702JLFTR | E149: Axial | F149: 5.5x16
A150: of:=IF(ISBLANK([Sheet1.A150]);"";[Sheet1.A150]) -> R11 | B150: TT Electronics | C150: CMO24702JLFTR | D150: 66-CMO24702JLFTR | E150: Axial | F150: 5.5x16
A151: of:=IF(ISBLANK([Sheet1.A151]);"";[Sheet1.A151]) -> 
A152: of:=IF(ISBLANK([Sheet1.A152]);"";[Sheet1.A152]) -> R60 | B152: Vishay | C152: AC03000003900JAC00 | D152: 594-AC03W390R0J | E152: Axial | F152: 4.8x13
A153: of:=IF(ISBLANK([Sheet1.A153]);"";[Sheet1.A153]) -> R60 | B153: Vishay | C153: AC03000001001JAC00 | D153: 594-AC03W1K000J | E153: Axial | F153: 4.8x13
A154: of:=IF(ISBLANK([Sheet1.A154]);"";[Sheet1.A154]) -> R60 | B154: Vishay | C154: AC03000001501JAC00 | D154: 594-AC03W1K500J | E154: Axial | F154: 4.8x13
A155: of:=IF(ISBLANK([Sheet1.A155]);"";[Sheet1.A155]) -> R60 | B155: Vishay | C155: AC03000002701JAC00 | D155: 594-AC03W2K700J | E155: Axial | F155: 4.8x13
A156: of:=IF(ISBLANK([Sheet1.A156]);"";[Sheet1.A156]) -> 
A157: of:=IF(ISBLANK([Sheet1.A157]);"";[Sheet1.A157]) -> R1,2 | B157: Vishay | C157: RS005R1000FE12 | D157: 71-RS005R1000FE12 | E157: Axial | F157: 7.92x22.23
A158: of:=IF(ISBLANK([Sheet1.A158]);"";[Sheet1.A158]) -> R1,2 | B158: Vishay | C158: RS005R2000FE12 | D158: 71-RS005R2000FE12 | E158: Axial | F158: 7.92x22.23
A159: of:=IF(ISBLANK([Sheet1.A159]);"";[Sheet1.A159]) -> R1,2
A160: of:=IF(ISBLANK([Sheet1.A160]);"";[Sheet1.A160]) -> R1,2
A161: of:=IF(ISBLANK([Sheet1.A161]);"";[Sheet1.A161]) -> 
A162: of:=IF(ISBLANK([Sheet1.A162]);"";[Sheet1.A162]) -> R58,59 | B162: Vishay | C162: RS010R2000FE12 | D162: 71-RS010R2000FE12 | E162: Axial | F162: 9.53x45.21
A163: of:=IF(ISBLANK([Sheet1.A163]);"";[Sheet1.A163]) -> R58 | B163: Vishay | C163: RS010R2000FE12 | D163: 71-RS010R2000FE12 | E163: Axial | F163: 9.53x45.21
A164: of:=IF(ISBLANK([Sheet1.A164]);"";[Sheet1.A164]) -> R58
A165: of:=IF(ISBLANK([Sheet1.A165]);"";[Sheet1.A165]) -> R58,59
A166: of:=IF(ISBLANK([Sheet1.A166]);"";[Sheet1.A166]) -> 
A167: of:=IF(ISBLANK([Sheet1.A167]);"";[Sheet1.A167]) -> Alternatives
A168: of:=IF(ISBLANK([Sheet1.A168]);"";[Sheet1.A168]) -> R1,2
A169: of:=IF(ISBLANK([Sheet1.A169]);"";[Sheet1.A169]) -> R58,59
A170: of:=IF(ISBLANK([Sheet1.A170]);"";[Sheet1.A170]) -> R74,75
A171: of:=IF(ISBLANK([Sheet1.A171]);"";[Sheet1.A171]) -> R74,75
A172: of:=IF(ISBLANK([Sheet1.A172]);"";[Sheet1.A172]) -> 
A173: of:=IF(ISBLANK([Sheet1.A173]);"";[Sheet1.A173]) -> R1,2
A174: of:=IF(ISBLANK([Sheet1.A174]);"";[Sheet1.A174]) -> R58,59
A175: of:=IF(ISBLANK([Sheet1.A175]);"";[Sheet1.A175]) -> R74,75
A176: of:=IF(ISBLANK([Sheet1.A176]);"";[Sheet1.A176]) -> 
A177: of:=IF(ISBLANK([Sheet1.A177]);"";[Sheet1.A177]) -> R1,2 | B177: Vishay | C177: RW74UR604FB12 | D177: 71-RW74UR604F | E177: Axial | F177: 7.92x22.23
A178: of:=IF(ISBLANK([Sheet1.A178]);"";[Sheet1.A178]) -> R58 | B178: Ohmite | C178: 80FR619 | D178: 588-80FR619 | E178: Axial | F178: 10.3x46.8
A179: of:=IF(ISBLANK([Sheet1.A179]);"";[Sheet1.A179]) -> R74,75 | B179: KOA Speer | C179: MF1/4DC2102F | D179: 660-MF1/4DC2102F | E179: Axial | F179: 2.3x7.1
A180: of:=IF(ISBLANK([Sheet1.A180]);"";[Sheet1.A180]) -> R74,75 | B180: KOA Speer | C180: MF1/4DC2152F | D180: 660-MF1/4DC2152F | E180: Axial | F180: 2.3x7.1
A181: of:=IF(ISBLANK([Sheet1.A181]);"";[Sheet1.A181]) -> 
A182: of:=IF(ISBLANK([Sheet1.A182]);"";[Sheet1.A182]) -> R1,2 | B182: Vishay | C182: RW74U1R75FB12 | D182: 71-RW74U1R75F | E182: Axial | F182: 7.92x22.23
A183: of:=IF(ISBLANK([Sheet1.A183]);"";[Sheet1.A183]) -> R58,59 | B183: Vishay | C183: RW74U1R75FB12 | D183: 71-RW74U1R75F | E183: Axial | F183: 7.92x22.23
A184: of:=IF(ISBLANK([Sheet1.A184]);"";[Sheet1.A184]) -> R74,75 | B184: KOA Speer | C184: MF1/4DC1742F | D184: 660-MF1/4DC1742F | E184: Axial | F184: 2.3x7.1
A185: of:=IF(ISBLANK([Sheet1.A185]);"";[Sheet1.A185]) -> R74,75 | B185: KOA Speer | C185: MF1/4DC1782F | D185: 660-MF1/4DC1782F | E185: Axial | F185: 2.3x7.1
A186: of:=IF(ISBLANK([Sheet1.A186]);"";[Sheet1.A186]) -> 
A187: of:=IF(ISBLANK([Sheet1.A187]);"";[Sheet1.A187]) -> 
A188: of:=IF(ISBLANK([Sheet1.A188]);"";[Sheet1.A188]) -> Fusible Resistors
A189: of:=IF(ISBLANK([Sheet1.A189]);"";[Sheet1.A189]) -> R10,108 | B189: Bourns | C189: FW10A10R0JA | D189: 652-FW10A10R0JA | E189: Axial | F189: 5.5x12
A190: of:=IF(ISBLANK([Sheet1.A190]);"";[Sheet1.A190]) -> Variable Resistors
A191: of:=IF(ISBLANK([Sheet1.A191]);"";[Sheet1.A191]) -> R69 | B191: Bourns | C191: 3296Y-1-503LF | D191: 652-3296Y-1-503LF | I191: Murata | J191: PV36W503C01B00 | K191: 81-PV36W503C01B00
A192: of:=IF(ISBLANK([Sheet1.A192]);"";[Sheet1.A192]) -> R84,85 | B192: Bourns | C192: 3590S-2-103L | D192: 652-3590S-2-103L | I192: Vishay / Spectro | J192: 534-11103 | K192: 594-53411103
A193: of:=IF(ISBLANK([Sheet1.A193]);"";[Sheet1.A193]) -> R94 | B193: Bourns | C193: 3296Y-1-103LF | D193: 652-3296Y-1-103LF | I193: Murata | J193: PV36W103C01B00 | K193: 81-PV36W103C01B00
A194: of:=IF(ISBLANK([Sheet1.A194]);"";[Sheet1.A194]) -> R97 | B194: Bourns | C194: 3296Y-1-103LF | D194: 652-3296Y-1-103LF | I194: Murata | J194: PV36W103C01B00 | K194: 81-PV36W103C01B00
A195: of:=IF(ISBLANK([Sheet1.A195]);"";[Sheet1.A195]) -> 
A196: of:=IF(ISBLANK([Sheet1.A196]);"";[Sheet1.A196]) -> U1 | B196: Fairchild | C196: LM7805CT | D196: 512-LM7805CT | E196: TO-220AB
A197: of:=IF(ISBLANK([Sheet1.A197]);"";[Sheet1.A197]) -> U2 | B197: Fairchild | C197: LM358N | D197: 512-LM358N | E197: DIP-8
A198: of:=IF(ISBLANK([Sheet1.A198]);"";[Sheet1.A198]) -> U3,16,20 | B198: Fairchild | C198: LM393N | D198: 512-LM393N | E198: DIP-8
A199: of:=IF(ISBLANK([Sheet1.A199]);"";[Sheet1.A199]) -> U4,5 | B199: Fairchild | C199: LM339N | D199: 512-LM339N | E199: DIP-14
A200: of:=IF(ISBLANK([Sheet1.A200]);"";[Sheet1.A200]) -> U6,9 | B200: TI | C200: LF347BN | D200: 595-LF347BN | E200: DIP-14
A201: of:=IF(ISBLANK([Sheet1.A201]);"";[Sheet1.A201]) -> U7,15,17 | B201: TI | C201: LM336BZ-5.0/NOPB | D201: 926-LM336BZ-5.0/NOPB | E201: TO-92
A202: of:=IF(ISBLANK([Sheet1.A202]);"";[Sheet1.A202]) -> U8 | B202: Fairchild | C202: MOC3020M | D202: 512-MOC3020M | E202: DIP-6
A203: of:=IF(ISBLANK([Sheet1.A203]);"";[Sheet1.A203]) -> U10 | B203: LT | C203: LT1055CN8#PBF | E203: DIP-8 | I203: XXXXXXXXXXX | J203: '=> TME
A204: of:=IF(ISBLANK([Sheet1.A204]);"";[Sheet1.A204]) -> U11 | B204: TI | C204: LF442CN/NOPB | D204: 926-LF442CN/NOPB | E204: DIP-8
A205: of:=IF(ISBLANK([Sheet1.A205]);"";[Sheet1.A205]) -> U12 | B205: ON | C205: MC3423P1 | D205: 863-MC3423P1 | I205: XXXXXXXXXXX | J205: '=> eBay
A206: of:=IF(ISBLANK([Sheet1.A206]);"";[Sheet1.A206]) -> U13 | B206: Fairchild | C206: LM317T | D206: 512-LM317T | E206: TO-220AB
A207: of:=IF(ISBLANK([Sheet1.A207]);"";[Sheet1.A207]) -> U14 | B207: Fairchild | C207: LM7912CT | D207: 512-LM7912CT | E207: TO-220AB
A208: of:=IF(ISBLANK([Sheet1.A208]);"";[Sheet1.A208]) -> U18 | B208: Fairchild | C208: LM358N | D208: 512-LM358N | E208: DIP-8
A209: of:=IF(ISBLANK([Sheet1.A209]);"";[Sheet1.A209]) -> U19 | B209: TI | C209: SN74LS00N | D209: 595-SN74LS00N | E209: DIP-14
A210: of:=IF(ISBLANK([Sheet1.A210]);"";[Sheet1.A210]) -> U21,22,23,24 | B210: Fairchild | C210: MOC3020M | D210: 512-MOC3020M | E210: DIP-6
A211: of:=IF(ISBLANK([Sheet1.A211]);"";[Sheet1.A211]) -> 
A212: of:=IF(ISBLANK([Sheet1.A212]);"";[Sheet1.A212]) -> Q1,4 | B212: IRF | C212: IRFP044NPBF | D212: 942-IRFP044NPBF | E212: TO-247
A213: of:=IF(ISBLANK([Sheet1.A213]);"";[Sheet1.A213]) -> Q1,4 | B213: Vishay | C213: IRFP440PBF | D213: 844-IRFP440PBF | E213: TO-247
A214: of:=IF(ISBLANK([Sheet1.A214]);"";[Sheet1.A214]) -> Q2,3,10,11 | B214: Fairchild | C214: PN2222ATA | D214: 512-PN2222ATA | E214: TO-92
A215: of:=IF(ISBLANK([Sheet1.A215]);"";[Sheet1.A215]) -> Q5,6,7,8 | B215: Fairchild | C215: PN2222ATA | D215: 512-PN2222ATA | E215: TO-92
A216: of:=IF(ISBLANK([Sheet1.A216]);"";[Sheet1.A216]) -> Q6,7 | B216: Fairchild | C216: PN2907ATA | D216: 512-PN2907ATA | E216: TO-92
A217: of:=IF(ISBLANK([Sheet1.A217]);"";[Sheet1.A217]) -> Q9 | B217: Fairchild | C217: BC640TA | D217: 512-BC640TA | E217: TO-92
A218: of:=IF(ISBLANK([Sheet1.A218]);"";[Sheet1.A218]) -> 
A219: of:=IF(ISBLANK([Sheet1.A219]);"";[Sheet1.A219]) -> CR1,19 | B219: Vishay | C219: VS-MUR820PBF | D219: 844-MUR820PBF | E219: TO-220AC | M219: Vishay Semiconductors | N219: BYV98-100-TAP | O219: 78-BYV98-100-TAP
A220: of:=IF(ISBLANK([Sheet1.A220]);"";[Sheet1.A220]) -> CR2 | B220: Fairchild | C220: DF01M | D220: 512-DF01M | E220: EDIP-4 | I220: Fairchild | J220: DF02M | K220: 512-DF02M
A221: of:=IF(ISBLANK([Sheet1.A221]);"";[Sheet1.A221]) -> CR3,4,5,6,7 | B221: Micro Commercial | C221: 6A4-TP | D221: 833-6A4-TP | E221: R-6 | M221: Vishay Semiconductors | N221: BAV20-TR | O221: 78-BAV20
A222: of:=IF(ISBLANK([Sheet1.A222]);"";[Sheet1.A222]) -> CR8,9,16,17,31,32 | B222: Vishay | C222: UF4004-E3/54 | D222: 625-UF4004-E3 | E222: DO-41 | F222: 2.6x4.1
A223: of:=IF(ISBLANK([Sheet1.A223]);"";[Sheet1.A223]) -> CR10,12,15,18,20 | B223: ST | C223: TYN640RG | D223: 511-TYN640 | E223: TO-220AB
A224: of:=IF(ISBLANK([Sheet1.A224]);"";[Sheet1.A224]) -> CR11,14 | B224: Vishay | C224: UF4004-E3/54 | D224: 625-UF4004-E3 | E224: DO-41 | F224: 2.6x4.1
A225: of:=IF(ISBLANK([Sheet1.A225]);"";[Sheet1.A225]) -> CR13 | B225: Fairchild | C225: GBU8J | D225: 512-GBU8J | E225: GBU
A226: of:=IF(ISBLANK([Sheet1.A226]);"";[Sheet1.A226]) -> CR21,22,23,24,25,26,27,28,29,30 | B226: Micro Commercial | C226: 6A4-TP | D226: 833-6A4-TP | E226: R-6 | F226: 8.9x8.9 | M226: Vishay Semiconductors | N226: BAV20-TR | O226: 78-BAV20
A227: of:=IF(ISBLANK([Sheet1.A227]);"";[Sheet1.A227]) -> 
A228: of:=IF(ISBLANK([Sheet1.A228]);"";[Sheet1.A228]) -> VR1,2,3 | B228: Diodes Inc | C228: 1N4733A-T | D228: 621-1N4733A-T | E228: DO-41 | F228: 2.6x4.1
A229: of:=IF(ISBLANK([Sheet1.A229]);"";[Sheet1.A229]) -> 
A230: of:=IF(ISBLANK([Sheet1.A230]);"";[Sheet1.A230]) -> RT1,2 | B230: Littelfuse | C230: V275LA20AP | D230: 576-V275LA20AP | E230: Disc | F230: 14
A231: of:=IF(ISBLANK([Sheet1.A231]);"";[Sheet1.A231]) -> 
A232: of:=IF(ISBLANK([Sheet1.A232]);"";[Sheet1.A232]) -> T1
A233: of:=IF(ISBLANK([Sheet1.A233]);"";[Sheet1.A233]) -> T1
A234: of:=IF(ISBLANK([Sheet1.A234]);"";[Sheet1.A234]) -> T1
A235: of:=IF(ISBLANK([Sheet1.A235]);"";[Sheet1.A235]) -> T1
A236: of:=IF(ISBLANK([Sheet1.A236]);"";[Sheet1.A236]) -> T2,3
A237: of:=IF(ISBLANK([Sheet1.A237]);"";[Sheet1.A237]) -> 
A238: of:=IF(ISBLANK([Sheet1.A238]);"";[Sheet1.A238]) -> L1
A239: of:=IF(ISBLANK([Sheet1.A239]);"";[Sheet1.A239]) -> 
A240: of:=IF(ISBLANK([Sheet1.A240]);"";[Sheet1.A240]) -> J1
A241: of:=IF(ISBLANK([Sheet1.A241]);"";[Sheet1.A241]) -> 
A242: of:=IF(ISBLANK([Sheet1.A242]);"";[Sheet1.A242]) -> TP1-16
A243: of:=IF(ISBLANK([Sheet1.A243]);"";[Sheet1.A243]) -> 
A244: of:=IF(ISBLANK([Sheet1.A244]);"";[Sheet1.A244]) -> S1,2,3,4 | B244: Apem Inc | C244: 25136NAB | D244: 642-25136NAB | I244: XXXXXXXXXXX
A245: of:=IF(ISBLANK([Sheet1.A245]);"";[Sheet1.A245]) -> S5 | B245: Apem Inc | C245: 25146NAB | D245: 642-25146NAB | I245: XXXXXXXXXXX
A246: of:=IF(ISBLANK([Sheet1.A246]);"";[Sheet1.A246]) -> S6
A247: of:=IF(ISBLANK([Sheet1.A247]);"";[Sheet1.A247]) -> S7
A248: of:=IF(ISBLANK([Sheet1.A248]);"";[Sheet1.A248]) -> S8
A249: of:=IF(ISBLANK([Sheet1.A249]);"";[Sheet1.A249]) -> 
A250: of:=IF(ISBLANK([Sheet1.A250]);"";[Sheet1.A250]) -> 
A251: of:=IF(ISBLANK([Sheet1.A251]);"";[Sheet1.A251]) -> 
A252: of:=IF(ISBLANK([Sheet1.A252]);"";[Sheet1.A252]) -> 
A253: of:=IF(ISBLANK([Sheet1.A253]);"";[Sheet1.A253]) -> 
A254: of:=IF(ISBLANK([Sheet1.A254]);"";[Sheet1.A254]) -> 
A255: of:=IF(ISBLANK([Sheet1.A255]);"";[Sheet1.A255]) -> 
A256: of:=IF(ISBLANK([Sheet1.A256]);"";[Sheet1.A256]) -> 
A257: of:=IF(ISBLANK([Sheet1.A257]);"";[Sheet1.A257]) -> 
A258: of:=IF(ISBLANK([Sheet1.A258]);"";[Sheet1.A258]) ->  | B258: Pomona | C258: 3750-2 | D258: 565-3750-2
A259: of:=IF(ISBLANK([Sheet1.A259]);"";[Sheet1.A259]) ->  | B259: Pomona | C259: 3750-0 | D259: 565-3750-0
A260: of:=IF(ISBLANK([Sheet1.A260]);"";[Sheet1.A260]) ->  | B260: Pomona | C260: 3750-5 | D260: 565-3750-5
A261: of:=IF(ISBLANK([Sheet1.A261]);"";[Sheet1.A261]) -> 
A262: of:=IF(ISBLANK([Sheet1.A262]);"";[Sheet1.A262]) -> 
A263: of:=IF(ISBLANK([Sheet1.A263]);"";[Sheet1.A263]) -> 
A264: of:=IF(ISBLANK([Sheet1.A264]);"";[Sheet1.A264]) -> 
A265: of:=IF(ISBLANK([Sheet1.A265]);"";[Sheet1.A265]) ->  | B265: Bergquist | C265: SP900S-0.009-00-104 | D265: 951-SP900S-009-00104
A266: of:=IF(ISBLANK([Sheet1.A266]);"";[Sheet1.A266]) -> 
A267: of:=IF(ISBLANK([Sheet1.A267]);"";[Sheet1.A267]) -> 
A268: of:=IF(ISBLANK([Sheet1.A268]);"";[Sheet1.A268]) -> 
A269: of:=IF(ISBLANK([Sheet1.A269]);"";[Sheet1.A269]) -> 
A270: of:=IF(ISBLANK([Sheet1.A270]);"";[Sheet1.A270]) -> 
A271: of:=IF(ISBLANK([Sheet1.A271]);"";[Sheet1.A271]) -> 
A272: of:=IF(ISBLANK([Sheet1.A272]);"";[Sheet1.A272]) -> 
A273: of:=IF(ISBLANK([Sheet1.A273]);"";[Sheet1.A273]) -> 